gde_nr,gde_name,knt_name,einwohner,jur_steuerpflichtige,jur_steuerertrag,jur_kopfquote,nat_steuerertrag,nat_kopfquote,nat_steuerpflichtige,nat_nicht_pflichtige,nachbarn,anzahl_nachbarn
4471,Bischofszell,Thurgau,5982,204,2581316,431.51387495820796,3448121.7250969959,576.41620279120627,2676,823,"Niederbüren, Niederhelfenschwil, Waldkirch, Hauptwil-Gottshaus, Hohentannen, Kradolf-Schönenberg, Zihlschlacht-Sitterdorf",7
4476,Erlen,Thurgau,3779,129,2020597,534.69092352474195,2143389.2282058368,567.18423609574938,1511,545,"Sommeri, Amriswil, Hohentannen, Sulgen, Zihlschlacht-Sitterdorf, Langrickenbach, Birwinken",7
4486,Hauptwil-Gottshaus,Thurgau,1993,86,410358,205.89964877069744,1430982.2901978847,718.00415965774448,851,282,"Häggenschwil, Waldkirch, Bischofszell, Zihlschlacht-Sitterdorf",4
4495,Hohentannen,Thurgau,584,22,43864,75.109589041095887,642702.05145683745,1100.5172113986944,267,89,"Bischofszell, Erlen, Kradolf-Schönenberg, Sulgen, Zihlschlacht-Sitterdorf",5
4501,Kradolf-Schönenberg,Thurgau,3609,129,942272,261.08949847603213,1975379.1308835512,547.34805510766171,1626,478,"Niederhelfenschwil, Bischofszell, Hohentannen, Sulgen, Schönholzerswilen, Wuppenau, Bürglen (TG)",7
4506,Sulgen,Thurgau,3918,182,1767659,451.1636038795304,2457851.010880373,627.32287158763984,1701,566,"Erlen, Hohentannen, Kradolf-Schönenberg, Birwinken, Bürglen (TG)",5
4511,Zihlschlacht-Sitterdorf,Thurgau,2442,80,994515,407.25429975429978,1568501.8215512706,642.30213822738347,1043,342,"Häggenschwil, Muolen, Amriswil, Bischofszell, Erlen, Hauptwil-Gottshaus, Hohentannen, Zihlschlacht-Sitterdorf",8
4536,Basadingen-Schlattingen,Thurgau,1829,56,445074,243.34281027884089,1465643.0907911435,801.33575220948251,806,234,"Truttikon, Stammheim, Diessenhofen, Schlatt (TG)",4
4545,Diessenhofen,Thurgau,4042,138,591223,146.26991588322613,3145012.2748892028,778.08319517298435,1737,507,"Stammheim, Dörflingen, Ramsen, Basadingen-Schlattingen, Schlatt (TG), Wagenhausen",6
4546,Schlatt (TG),Thurgau,1777,73,366656,206.33427124366909,1374182.6445296886,773.3160633256548,793,227,"Feuerthalen, Laufen-Uhwiesen, Trüllikon, Truttikon, Basadingen-Schlattingen, Diessenhofen, Schlatt (TG)",7
4551,Aadorf,Thurgau,9047,358,3660790,404.6413175638333,7419638.5546386763,820.12142750510407,4206,1107,"Hagenbuch, Turbenthal, Elgg, Frauenfeld, Matzingen, Bichelsee-Balterswil, Wängi",7
4561,Felben-Wellhausen,Thurgau,2869,118,1508401,525.75845242244679,2195745.6701040892,765.33484492997184,1286,316,"Frauenfeld, Hüttlingen, Thundorf, Warth-Weiningen, Pfyn",5
4566,Frauenfeld,Thurgau,25781,1297,20901209,810.72142275319038,29362093.909135886,1138.9043834271706,12367,3387,"Ellikon an der Thur, Hagenbuch, Wiesendangen, Aadorf, Felben-Wellhausen, Gachnang, Matzingen, Thundorf, Uesslingen-Buch, Warth-Weiningen",10
4571,Gachnang,Thurgau,4455,207,2055846,461.46936026936027,4630596.8285760656,1039.4156742033817,1948,475,"Ellikon an der Thur, Wiesendangen, Frauenfeld, Gachnang",4
4590,Hüttlingen,Thurgau,842,29,47558,56.482185273159146,561196.8886443919,666.50461834250825,359,103,"Felben-Wellhausen, Thundorf, Müllheim, Pfyn, Amlikon-Bissegg, Wigoltingen",6
4591,Matzingen,Thurgau,2967,112,425418,143.38321536905966,2045919.585809886,689.55833697670573,1238,382,"Aadorf, Frauenfeld, Stettfurt, Thundorf, Wängi",5
4601,Neunforn,Thurgau,1048,37,404786,386.24618320610688,1684641.9474236339,1607.4827742591926,519,117,"Ossingen, Thalheim an der Thur, Altikon, Stammheim, Uesslingen-Buch, Hüttwilen",6
4606,Stettfurt,Thurgau,1224,43,322615,263.57434640522877,2049394.3609736902,1674.3417981811194,527,143,"Matzingen, Thundorf, Lommis, Wängi",4
4611,Thundorf,Thurgau,1488,65,237060,159.31451612903226,924896.63317526865,621.57031799413221,634,194,"Felben-Wellhausen, Frauenfeld, Hüttlingen, Matzingen, Stettfurt, Affeltrangen, Lommis, Amlikon-Bissegg",8
4616,Uesslingen-Buch,Thurgau,1084,41,74992,69.180811808118079,1169332.9930859488,1078.720473326521,519,121,"Altikon, Ellikon an der Thur, Frauenfeld, Neunforn, Warth-Weiningen, Hüttwilen",6
4621,Warth-Weiningen,Thurgau,1333,53,53072,39.813953488372093,4176724.6725423182,3133.3268361157675,655,99,"Felben-Wellhausen, Frauenfeld, Uesslingen-Buch, Herdern, Hüttwilen, Pfyn",6
4641,Altnau,Thurgau,2285,102,686683,300.51772428884027,2612337.1881392905,1143.2547869318557,1009,316,"Güttingen, Langrickenbach, Münsterlingen",3
4643,Bottighofen,Thurgau,2301,292,2840380,1234.4111255975663,6742269.9939003624,2930.1477591918133,1100,274,"Kreuzlingen, Lengwil, Münsterlingen",3
4646,Ermatingen,Thurgau,3527,224,632313,179.27785653529912,6975889.1342148185,1977.8534545548109,1710,428,"Gottlieben, Tägerwilen, Wäldi, Raperswilen, Salenstein",5
4651,Gottlieben,Thurgau,333,34,87710,263.39339339339341,518846,1558.0960960960961,179,33,"Ermatingen, Tägerwilen",2
4656,Güttingen,Thurgau,1661,83,728138,438.37326911499099,1617471.514109968,973.79380741117882,769,207,"Kesswil, Sommeri, Altnau, Langrickenbach",4
4666,Kemmental,Thurgau,2601,106,749143,288.02114571318725,2058445.2545458453,791.40532662277792,1128,391,"Kreuzlingen, Lengwil, Tägerwilen, Wäldi, Berg (TG), Märstetten, Weinfelden, Wigoltingen",8
4671,Kreuzlingen,Thurgau,22188,1218,9452227,426.00626464755726,23762560.429746341,1070.964504675786,9984,3319,"Bottighofen, Kemmental, Lengwil, Tägerwilen",4
4681,Langrickenbach,Thurgau,1273,43,76555,60.137470542026712,781166.72113880853,613.64235753244975,568,170,"Sommeri, Erlen, Altnau, Güttingen, Lengwil, Münsterlingen, Birwinken",7
4683,Lengwil,Thurgau,1744,72,581256,333.28899082568807,1234156.6216913369,707.65861335512432,720,237,"Bottighofen, Kemmental, Kreuzlingen, Langrickenbach, Münsterlingen, Berg (TG), Birwinken",7
4691,Münsterlingen,Thurgau,3494,118,839989,240.40898683457357,5074170.1986920247,1452.2524896084788,1572,458,"Altnau, Bottighofen, Langrickenbach, Lengwil, Münsterlingen",5
4696,Tägerwilen,Thurgau,4762,381,6151447,1291.7780344393111,5684964.3743189927,1193.8186422341437,2065,695,"Ermatingen, Gottlieben, Kemmental, Kreuzlingen, Wäldi",5
4701,Wäldi,Thurgau,1047,57,354943,339.00955109837633,816452.29290515161,779.80161691036449,466,162,"Ermatingen, Kemmental, Tägerwilen, Raperswilen, Wigoltingen",5
4711,Affeltrangen,Thurgau,2606,128,1549593,594.62509593246352,1863730.7517625608,715.16912960957825,1110,296,"Thundorf, Braunau, Lommis, Tobel-Tägerschen, Amlikon-Bissegg, Bussnang",6
4716,Bettwiesen,Thurgau,1226,50,1084516,884.59706362153349,1815459.5872088796,1480.7990107739638,551,151,"Wil (SG), Lommis, Münchwilen (TG), Tobel-Tägerschen, Wängi",5
4721,Bichelsee-Balterswil,Thurgau,2878,119,743039,258.17894371091035,2009193.7035055987,698.12150920972852,1310,362,"Turbenthal, Aadorf, Eschlikon, Fischingen, Wängi",5
4723,Braunau,Thurgau,815,30,34063,41.795092024539876,743187.92278022796,911.88702181623069,361,101,"Wil (SG), Affeltrangen, Schönholzerswilen, Tobel-Tägerschen, Wuppenau, Bussnang",6
4724,Eschlikon,Thurgau,4480,193,1655427,369.51495535714287,4681149.7047815453,1044.8994876744521,2168,541,"Bichelsee-Balterswil, Fischingen, Münchwilen (TG), Sirnach, Wängi",5
4726,Fischingen,Thurgau,2802,126,750387,267.80406852248393,2067588.6298275269,737.89744105193677,1249,349,"Fischenthal, Wila, Turbenthal, Bauma, Kirchberg (SG), Mosnang, Bichelsee-Balterswil, Eschlikon, Sirnach",9
4741,Lommis,Thurgau,1211,57,2244106,1853.1015689512799,1801401.9351467707,1487.5325641178949,528,168,"Stettfurt, Thundorf, Affeltrangen, Bettwiesen, Tobel-Tägerschen, Wängi",6
4746,Münchwilen (TG),Thurgau,5680,214,1419462,249.90528169014084,4561166.7076858981,803.02230769117921,2532,699,"Wil (SG), Bettwiesen, Eschlikon, Münchwilen (TG), Sirnach, Wängi",6
4751,Rickenbach (TG),Thurgau,2803,93,1178165,420.32286835533358,1545005.4775536295,551.19710223104869,1225,373,"Kirchberg (SG), Jonschwil, Wil (SG), Rickenbach (TG), Wilen (TG)",5
4756,Schönholzerswilen,Thurgau,846,37,172824,204.28368794326241,576126.64721589081,681.00076503060382,339,121,"Kradolf-Schönenberg, Braunau, Wuppenau, Bürglen (TG), Bussnang",5
4761,Sirnach,Thurgau,7803,352,3886285,498.05010893246185,6665084.9569623666,854.16954465748643,3635,1010,"Kirchberg (SG), Wil (SG), Eschlikon, Fischingen, Münchwilen (TG), Wilen (TG)",6
4776,Tobel-Tägerschen,Thurgau,1604,58,517908,322.88528678304237,961056.0104647202,599.16210128723208,727,206,"Wil (SG), Affeltrangen, Bettwiesen, Braunau, Lommis, Tobel-Tägerschen",6
4781,Wängi,Thurgau,4769,205,1509205,316.46152233172575,4275919.0059880633,896.60704675782415,2112,631,"Aadorf, Matzingen, Stettfurt, Bettwiesen, Bichelsee-Balterswil, Eschlikon, Lommis, Münchwilen (TG), Wängi",9
4786,Wilen (TG),Thurgau,2521,91,842056,334.01666005553352,2398194.3536250074,951.28693122769039,1086,297,"Kirchberg (SG), Wil (SG), Rickenbach (TG), Sirnach, Wilen (TG)",5
4791,Wuppenau,Thurgau,1118,44,397304,355.37030411449018,1239136.2055656116,1108.3508099871303,435,145,"Niederhelfenschwil, Zuzwil (SG), Wil (SG), Kradolf-Schönenberg, Braunau, Schönholzerswilen, Wuppenau",7
4801,Berlingen,Thurgau,890,41,101835,114.42134831460675,1292927.4336166992,1452.7274535019092,453,121,"Raperswilen, Salenstein, Steckborn",3
4806,Eschenz,Thurgau,1832,62,626990,342.24344978165936,1577808.3598917015,861.24910474437854,816,243,"Stein am Rhein, Hüttwilen, Mammern, Wagenhausen",4
4811,Herdern,Thurgau,1115,44,181284,162.5865470852018,1362303.2931333117,1221.796675455885,505,132,"Warth-Weiningen, Homburg, Hüttwilen, Mammern, Pfyn",5
4816,Homburg,Thurgau,1542,53,379771,246.28469520103761,1427387.7297920096,925.6729765188129,640,209,"Herdern, Mammern, Müllheim, Pfyn, Raperswilen, Steckborn, Wigoltingen",7
4821,Hüttwilen,Thurgau,1773,78,139568,78.718556119571346,2237557.1381667471,1262.017562417793,744,217,"Stammheim, Neunforn, Uesslingen-Buch, Warth-Weiningen, Eschenz, Herdern, Mammern, Wagenhausen",8
4826,Mammern,Thurgau,659,32,385807,585.44309559939302,1055677.308460725,1601.9382525959409,293,78,"Eschenz, Herdern, Homburg, Hüttwilen, Steckborn",5
4831,Müllheim,Thurgau,3003,116,3052714,1016.5547785547785,2210618.3356522694,736.13664190884765,1330,384,"Hüttlingen, Homburg, Pfyn, Amlikon-Bissegg, Wigoltingen",5
4841,Pfyn,Thurgau,2071,73,547151,264.19652341863832,1355459.7262964009,654.49528068392124,896,279,"Felben-Wellhausen, Hüttlingen, Warth-Weiningen, Herdern, Homburg, Müllheim, Pfyn",7
4846,Raperswilen,Thurgau,413,21,27823,67.368038740920099,395024.56351377821,956.47594071132733,191,58,"Ermatingen, Wäldi, Berlingen, Homburg, Salenstein, Steckborn, Wigoltingen",7
4851,Salenstein,Thurgau,1369,156,605777,442.49598246895545,2905303.9492007405,2122.2088745074802,707,180,"Ermatingen, Berlingen, Raperswilen, Salenstein",4
4864,Steckborn,Thurgau,3746,149,1189798,317.61825947677522,5115091.8860126669,1365.4810160204663,1749,553,"Berlingen, Homburg, Mammern, Raperswilen, Steckborn",5
4871,Wagenhausen,Thurgau,1713,61,232390,135.66258026853473,1255911.9877825759,733.16520010658257,787,243,"Stammheim, Hemishofen, Ramsen, Stein am Rhein, Diessenhofen, Eschenz, Hüttwilen, Wagenhausen",8
4881,Amlikon-Bissegg,Thurgau,1341,48,204349,152.3855331841909,1183051.4790996555,882.21586808326288,625,163,"Hüttlingen, Thundorf, Affeltrangen, Müllheim, Bussnang, Märstetten, Weinfelden, Wigoltingen",8
4891,Berg (TG),Thurgau,3449,168,1312588,380.57060017396344,3461908.3631353751,1003.7426393549943,1483,488,"Kemmental, Lengwil, Berg (TG), Birwinken, Bürglen (TG), Weinfelden",6
4901,Birwinken,Thurgau,1340,41,299727,223.67686567164179,998345.64702568797,745.03406494454327,574,215,"Erlen, Sulgen, Langrickenbach, Lengwil, Berg (TG), Bürglen (TG)",6
4911,Bürglen (TG),Thurgau,3959,167,1089517,275.20005051780754,2226594.6273158868,562.4133941186883,1661,555,"Kradolf-Schönenberg, Sulgen, Schönholzerswilen, Berg (TG), Birwinken, Bürglen (TG), Bussnang, Weinfelden",8
4921,Bussnang,Thurgau,2458,88,10169798,4137.427990235964,1561084.2435999895,635.10343515052455,1018,356,"Affeltrangen, Braunau, Schönholzerswilen, Amlikon-Bissegg, Bürglen (TG), Weinfelden",6
4941,Märstetten,Thurgau,2889,126,792347,274.26341294565594,2915508.8058167556,1009.175772176101,1370,361,"Kemmental, Amlikon-Bissegg, Weinfelden, Wigoltingen",4
4946,Weinfelden,Thurgau,11602,658,15392930,1326.7479744871573,11068679.384907177,954.03201042123567,5445,1499,"Kemmental, Amlikon-Bissegg, Berg (TG), Bürglen (TG), Bussnang, Märstetten, Weinfelden",7
4951,Wigoltingen,Thurgau,2464,94,492653,199.94034090909091,1796310.9881339935,729.02231661282201,1025,331,"Hüttlingen, Kemmental, Wäldi, Homburg, Müllheim, Raperswilen, Amlikon-Bissegg, Märstetten, Wigoltingen",9
5001,Arbedo-Castione,Ticino,5057,221,715030,141.39410717816887,3443101.38,680.85848922285936,2197,929,"Roveredo (GR), Bellinzona, Lumino",3
5002,Bellinzona,Ticino,43279,1782,7745673,178.9707017260103,31744405.059999999,733.48286836572004,18358,8377,"Roveredo (GR), San Vittore, Arbedo-Castione, Cadenazzo, Isone, Lumino, Sant'Antonino, Cugnasco-Gerra, Ponte Capriasca, Riviera, C'za Cadenazzo/Monteceneri, Verzasca",12
5003,Cadenazzo,Ticino,2942,209,522867,177.72501699524133,1219593.3400000001,414.54566281441197,1089,585,"Bellinzona, Isone, Sant'Antonino, Locarno, Cugnasco-Gerra, Monteceneri, Gambarogno",7
5009,Isone,Ticino,396,10,6324,15.969696969696969,168500.73,425.50689393939399,190,59,"Bellinzona, Cadenazzo, Sant'Antonino, Ponte Capriasca, Capriasca, Monteceneri, C'za Cadenazzo/Monteceneri",7
5010,Lumino,Ticino,1571,50,150234,95.629535327816683,1158205.0900000001,737.24066836409941,667,266,"Roveredo (GR), San Vittore, Arbedo-Castione, Bellinzona, Lumino",5
5017,Sant'Antonino,Ticino,2510,166,3203289,1276.2107569721115,1629278.03,649.11475298804783,1047,492,"Bellinzona, Cadenazzo, Isone, Sant'Antonino",4
5048,Acquarossa,Ticino,1813,82,78115,43.086045228902371,866097.29,477.7149972421401,882,438,"Blenio, Serravalle, Faido",3
5049,Blenio,Ticino,1770,80,493804,278.98531073446327,672818.95,380.12370056497173,867,371,"Vals, Lumnezia, Rheinwald, Medel (Lucmagn), Acquarossa, Serravalle, Faido, Quinto",8
5050,Serravalle,Ticino,2075,66,100823,48.589397590361443,1193461.58,575.16220722891569,986,465,"Rheinwald, Rossa, Mesocco, Acquarossa, Blenio, Bodio, Faido, Pollegio, Biasca",9
5061,Airolo,Ticino,1481,60,314172,212.13504388926401,938176.35,633.47491559756918,700,255,"Andermatt, Hospental, Realp, Tujetsch, Bedretto, Quinto, Lavizzara",7
5063,Bedretto,Ticino,106,35,145158,1369.4150943396226,371305.96,3502.88641509434,71,17,"Realp, Airolo, Cevio, Lavizzara, Obergoms",5
5064,Bodio,Ticino,968,31,891571,921.04442148760336,277997.69,287.18769628099176,347,202,"Serravalle, Faido, Giornico, Personico, Pollegio",5
5071,Dalpe,Ticino,171,16,22321,130.53216374269005,177542.74,1038.2616374269005,112,32,"Faido, Prato (Leventina), Lavizzara",3
5072,Faido,Ticino,2889,100,67073,23.216683973693321,1356525.1,469.54832121841469,1374,616,"Acquarossa, Blenio, Serravalle, Bodio, Dalpe, Giornico, Prato (Leventina), Quinto, Lavizzara, Verzasca",10
5073,Giornico,Ticino,833,35,233883,280.77190876350539,285410.78999999998,342.63,353,173,"Bodio, Faido, Personico, Verzasca",4
5076,Personico,Ticino,331,18,11387,34.401812688821749,161907.78,489.14737160120848,155,61,"Bodio, Giornico, Pollegio, Biasca, Riviera, Verzasca",6
5077,Pollegio,Ticino,799,15,5677,7.1051314142678352,293228.01,366.99375469336672,348,141,"Serravalle, Bodio, Personico, Biasca, Riviera",5
5078,Prato (Leventina),Ticino,409,18,5906,14.440097799511003,181314.78,443.31242053789731,184,87,"Dalpe, Faido, Prato (Leventina), Quinto, Lavizzara",5
5079,Quinto,Ticino,1020,61,195225,191.39705882352942,581888.30000000005,570.4787254901961,456,196,"Medel (Lucmagn), Tujetsch, Blenio, Airolo, Faido, Prato (Leventina), Lavizzara",7
5091,Ascona,Ticino,5497,374,1234101,224.50445697653265,11212568.07,2039.7613370929598,3139,1273,"Brissago, Locarno, Losone, Ronco sopra Centovalli",4
5095,Brione (Verzasca),Ticino,172,8,2464,14.325581395348838,120575.34,701.01941860465115,94,52,NA,NA
5096,Brione sopra Minusio,Ticino,480,25,46634,97.154166666666669,609161.31000000006,1269.0860625,300,99,"Mergoscia, Minusio, Tenero-Contra, Avegno Gordevio",4
5097,Brissago,Ticino,1695,91,520558,307.11386430678465,2612151.7799999998,1541.0924955752212,1218,429,"Ascona, Ronco sopra Ascona, Centovalli",3
5102,Corippo,Ticino,9,0,-,.,1608,178.66666666666666,5,NA,NA,NA
5105,Frasco,Ticino,107,*,2499,23.355140186915889,49726.6,464.73457943925234,51,23,NA,NA
5108,Gordola,Ticino,4666,152,585568,125.49678525503643,3315601.29,710.58750321474497,2050,939,"Lavertezzo, Locarno, Mergoscia, Tenero-Contra, Cugnasco-Gerra, Verzasca",6
5112,Lavertezzo,Ticino,1299,102,536196,412.7759815242494,515330,396.71285604311009,485,271,"Gordola, Locarno, Cugnasco-Gerra",3
5113,Locarno,Ticino,15776,973,3464985,219.63647312373226,11455735.640000001,726.14957150101429,6701,3705,"Cadenazzo, Ascona, Gordola, Lavertezzo, Losone, Minusio, Muralto, Orselina, Cugnasco-Gerra, Avegno Gordevio, Terre di Pedemonte, Gambarogno",12
5115,Losone,Ticino,6695,271,642205,95.92307692307692,5455061.75,814.79637789395076,2927,1356,"Ascona, Locarno, Terre di Pedemonte, Centovalli",4
5117,Mergoscia,Ticino,209,*,0,0,82464.17,394.56540669856457,119,65,"Brione sopra Minusio, Gordola, Tenero-Contra, Avegno Gordevio, Verzasca",5
5118,Minusio,Ticino,7281,249,457593,62.847548413679441,9773525.8800000008,1342.3329048207665,3596,1486,"Brione sopra Locarno, Muralto, Orselina, Tenero-Contra, Avegno Gordevio",5
5120,Muralto,Ticino,2675,263,470740,175.97757009345796,4163780.63,1556.5535065420561,1415,624,"Locarno, Minusio, Orselina",3
5121,Orselina,Ticino,717,46,177764,247.92747559274756,1257521.48,1753.8653835425384,439,180,"Locarno, Minusio, Muralto, Avegno Gordevio",4
5125,Ronco sopra Ascona,Ticino,573,30,142202,248.17102966841188,2470013.58,4310.6694240837696,513,142,"Ascona, Brissago, Ronco sopra Ascona",3
5129,Sonogno,Ticino,82,*,0,0,24140.82,294.400243902439,39,14,NA,NA
5131,Tenero-Contra,Ticino,3223,104,327482,101.60781880235805,1806094.57,560.37684455476267,1358,679,"Brione sopra Minusio, Gordola, Mergoscia, Minusio, Tenero-Contra",5
5135,Vogorno,Ticino,270,10,1308,4.8444444444444441,112402.88,416.30696296296298,157,66,NA,NA
5136,Onsernone,Ticino,661,17,2107,3.1875945537065054,278482.71999999997,421.30517397881994,374,199,"Campo (Vallemaggia), Maggia, Terre di Pedemonte, Centovalli",4
5138,Cugnasco-Gerra,Ticino,2845,83,100492,35.322319859402462,2155225.41,757.54847451669605,1240,521,"Bellinzona, Cadenazzo, Gordola, Lavertezzo, Locarno, Verzasca",6
5141,Agno,Ticino,4403,337,1109328,251.94821712468772,4283470.2300000004,972.85265273677044,1927,913,"Bioggio, Magliaso, Muzzano, Neggio, Vernate",5
5143,Aranno,Ticino,376,8,1946,5.1755319148936172,503907.14,1340.1785638297872,167,69,"Bioggio, Cademario, Curio, Miglieglia, Novaggio, Alto Malcantone",6
5144,Arogno,Ticino,992,33,28038,28.264112903225808,652818.74,658.08340725806454,440,233,"Bissone, Lugano, Val Mara",3
5146,Astano,Ticino,299,4,850,2.8428093645484949,255839.11,855.64919732441467,151,67,"Curio, Novaggio, Tresa",3
5148,Bedano,Ticino,1545,141,718861,465.28220064724917,1731600.8,1120.7772168284789,633,283,"Gravesano, Lamone, Torricella-Taverne, Alto Malcantone",4
5149,Bedigliora,Ticino,611,22,8907,14.577741407528642,476689.04,780.17846153846153,264,154,"Curio, Novaggio, Pura, Tresa",4
5151,Bioggio,Ticino,2658,282,8115095,3053.0831452219713,4632282.43,1742.7699134687734,1263,464,"Agno, Aranno, Cademario, Curio, Lugano, Manno, Muzzano, Vernate, Vezia, Alto Malcantone",10
5154,Bissone,Ticino,913,46,110983,121.55859802847755,2198597.04,2408.1019058050383,533,201,"Arogno, Val Mara",2
5160,Brusino Arsizio,Ticino,459,25,21878,47.664488017429193,654711.78,1426.3873202614379,285,85,"Mendrisio, Riva San Vitale",2
5161,Cademario,Ticino,776,20,10225,13.176546391752577,1213478.76,1563.7612886597938,361,159,"Aranno, Bioggio, Alto Malcantone",3
5162,Cadempino,Ticino,1536,206,11818874,7694.579427083333,1771264.27,1153.1668424479167,660,314,"Cureglia, Lamone, Manno, Vezia",4
5167,Canobbio,Ticino,2316,97,125934,54.375647668393782,3498439.17,1510.5523186528496,1027,393,"Comano, Lugano, Porza, Capriasca",4
5171,Caslano,Ticino,4304,165,1984118,460.99395910780669,3138797.33,729.27447258364316,1807,998,"Magliaso, Neggio, Pura, Tresa",4
5176,Comano,Ticino,2047,68,148375,72.484123106985834,6732830,3289.1206643869077,930,286,"Canobbio, Cureglia, Origlio, Porza, Capriasca",5
5178,Croglio,Ticino,858,51,133530,155.62937062937064,839560.36,978.50857808857802,388,179,NA,NA
5180,Cureglia,Ticino,1422,67,116223,81.732067510548518,3472939,2442.2918424753866,676,227,"Cadempino, Comano, Lamone, Origlio, Porza, Vezia",6
5181,Curio,Ticino,565,28,12755,22.575221238938052,389807.92,689.92552212389376,238,135,"Aranno, Astano, Bedigliora, Bioggio, Neggio, Novaggio, Pura, Vernate, Tresa",9
5186,Grancia,Ticino,463,59,661700,1429.1576673866091,491060.63,1060.6061123110151,192,104,"Lugano, Collina d'Oro",2
5187,Gravesano,Ticino,1375,119,911424,662.85381818181816,1762459.76,1281.7889163636364,615,249,"Bedano, Lamone, Manno, Alto Malcantone",4
5189,Lamone,Ticino,1727,160,670564,388.28257093225244,946688.73,548.16950202663577,722,376,"Bedano, Cadempino, Cureglia, Gravesano, Manno, Origlio, Torricella-Taverne",7
5192,Lugano,Ticino,62615,11273,88885922,1419.5627565279885,126267634.93000001,2016.5716670126967,27684,13428,"Arogno, Bioggio, Canobbio, Grancia, Massagno, Melide, Morcote, Muzzano, Paradiso, Ponte Capriasca, Porza, Savosa, Sorengo, Capriasca, Vezia, Vico Morcote, Collina d'Oro, C'za Capriasca/Lugano",18
5193,Magliaso,Ticino,1627,84,383927,235.97234173325137,2398545.33,1474.2134787953289,744,342,"Agno, Caslano, Neggio, Pura",4
5194,Manno,Ticino,1305,392,16255886,12456.617624521074,2039064.38,1562.5014406130267,576,226,"Bioggio, Cadempino, Gravesano, Lamone, Vezia, Alto Malcantone",6
5195,Maroggia,Ticino,700,66,170623,243.74714285714285,1758006.1,2511.4372857142857,379,154,NA,NA
5196,Massagno,Ticino,6153,331,1631643,265.17844953681129,9956742.5099999998,1618.1931594344221,2606,1313,"Lugano, Savosa",2
5197,Melano,Ticino,1437,86,448127,311.84899095337511,1960135.56,1364.0470146137789,618,319,NA,NA
5198,Melide,Ticino,1806,154,218574,121.02657807308969,3075717.57,1703.0551328903653,887,371,"Lugano, Vico Morcote",2
5199,Mezzovico-Vira,Ticino,1377,200,1655353,1202.1445170660857,2154024.06,1564.2876252723313,571,223,"Capriasca, Torricella-Taverne, Alto Malcantone, Monteceneri, Gambarogno",5
5200,Miglieglia,Ticino,317,7,2608,8.2271293375394325,117614.02,371.02214511041012,140,61,"Aranno, Novaggio, Alto Malcantone",3
5202,Monteggio,Ticino,849,36,995198,1172.2002355712602,541116.67000000004,637.35767962308603,399,206,NA,NA
5203,Morcote,Ticino,715,49,190303,266.15804195804196,4733778.8499999996,6620.6697202797195,519,170,"Lugano, Vico Morcote",2
5205,Muzzano,Ticino,810,83,695096,858.14320987654321,1745591.62,2155.0513827160494,374,177,"Agno, Bioggio, Lugano, Sorengo, Collina d'Oro",5
5206,Neggio,Ticino,324,11,33412,103.12345679012346,591035.06000000006,1824.1822839506174,153,66,"Agno, Caslano, Curio, Magliaso, Pura, Vernate",6
5207,Novaggio,Ticino,832,20,21325,25.631009615384617,492576.44,592.03899038461543,369,176,"Aranno, Astano, Bedigliora, Curio, Miglieglia, Novaggio",6
5208,Origlio,Ticino,1482,44,52984,35.751686909581643,3569295.87,2408.4317611336032,649,283,"Comano, Cureglia, Lamone, Ponte Capriasca, Capriasca, Torricella-Taverne",6
5210,Paradiso,Ticino,4303,863,30534171,7096.0192888682313,13129029.119999999,3051.1338879851264,1916,990,"Lugano, Paradiso",2
5212,Ponte Capriasca,Ticino,1907,52,61465,32.231253277399055,2400840.09,1258.9617671735709,794,373,"Bellinzona, Isone, Lugano, Origlio, Capriasca, Torricella-Taverne, Monteceneri, C'za Cadenazzo/Monteceneri",8
5213,Ponte Tresa,Ticino,773,43,50597,65.455368693402335,666161.4,861.78706338939196,395,206,NA,NA
5214,Porza,Ticino,1526,113,168413,110.36238532110092,6366509.21,4172.0243840104849,718,287,"Canobbio, Comano, Cureglia, Lugano, Savosa, Vezia",6
5216,Pura,Ticino,1348,46,28412,21.077151335311573,1611677.12,1195.6061721068249,586,293,"Bedigliora, Caslano, Curio, Magliaso, Neggio, Tresa",6
5219,Rovio,Ticino,817,38,46119,56.44920440636475,1033289.45,1264.7361689106488,397,170,NA,NA
5221,Savosa,Ticino,2199,180,390764,177.70077307867211,4949313.91,2250.7111914506595,930,421,"Lugano, Massagno, Porza, Vezia",4
5222,Sessa,Ticino,685,25,15954,23.290510948905109,525104.28,766.57559124087595,312,142,NA,NA
5225,Sorengo,Ticino,1835,111,391799,213.51444141689373,5125818.49,2793.3615749318801,759,300,"Lugano, Muzzano, Collina d'Oro",3
5226,Capriasca,Ticino,6737,184,382869,56.830785215971503,5698337.9000000004,845.8272079560636,2898,1295,"Isone, Canobbio, Comano, Lugano, Mezzovico-Vira, Origlio, Ponte Monteceneri, C'za Capriasca/Lugano",8
5227,Torricella-Taverne,Ticino,3104,194,707701,227.99645618556701,2038447.76,656.71641752577318,1251,579,"Bedano, Lamone, Mezzovico-Vira, Origlio, Ponte Capriasca, Alto Malcantone, Monteceneri",7
5230,Vernate,Ticino,583,15,4554,7.8113207547169807,1298571.79,2227.3958662092623,307,116,"Agno, Bioggio, Curio, Neggio, Vernate",5
5231,Vezia,Ticino,1877,132,493602,262.97389451251996,2275263.3199999998,1212.1807778369739,806,379,"Bioggio, Cadempino, Cureglia, Lugano, Manno, Porza, Savosa, Vezia",8
5233,Vico Morcote,Ticino,431,27,39430,91.484918793503482,2172371.9500000002,5040.3061484918799,285,84,"Lugano, Melide, Morcote, Vico Morcote",4
5236,Collina d'Oro,Ticino,4615,342,3780029,819.07453954496214,22020106.789999999,4771.420756229686,2215,810,"Grancia, Lugano, Muzzano, Sorengo, Collina d'Oro",5
5237,Alto Malcantone,Ticino,1392,29,22761,16.351293103448278,1008470.72,724.47609195402299,656,306,"Aranno, Bedano, Bioggio, Cademario, Gravesano, Manno, Mezzovico-Vira, Miglieglia, Torricella-Taverne, Gambarogno",10
5238,Monteceneri,Ticino,4508,260,957941,212.49800354924579,2287015.6,507.32377994676131,1907,828,"Cadenazzo, Isone, Mezzovico-Vira, Ponte Capriasca, Capriasca, Torricella-Taverne, Gambarogno",7
