gde_nr,gde_name,knt_name,einwohner,jur_steuerpflichtige,jur_steuerertrag,jur_kopfquote,nat_steuerertrag,nat_kopfquote,nat_steuerpflichtige,nat_nicht_pflichtige,nachbarn,anzahl_nachbarn
NA,SCHWEIZ / SUISSE,NA,8606033,463371,13514546572,1570.3572798291616,11811543155.749998,1372.4724452892522,3852847,1389435,NA,NA
1,Aeugst am Albis,Zürich,1981,57,87998,44.420999495204441,5351880.9428072423,2701.605725798709,933,241,"Affoltern am Albis, Hausen am Albis, Mettmenstetten, Rifferswil, Stallikon, Langnau am Albis",6
2,Affoltern am Albis,Zürich,12303,486,1524037,123.87523368284158,11960946.775729431,972.19757585381058,5507,1683,"Aeugst am Albis, Hedingen, Mettmenstetten, Obfelden, Ottenbach, Stallikon, Jonen",7
3,Bonstetten,Zürich,5572,127,159951,28.706209619526202,7816648.9963891078,1402.8443999262577,2519,579,"Hedingen, Stallikon, Wettswil am Albis, Aesch (ZH), Birmensdorf (ZH), Islisberg",6
4,Hausen am Albis,Zürich,3751,108,126978,33.851772860570513,6421497.5544187417,1711.9428297570626,1643,472,"Aeugst am Albis, Kappel am Albis, Rifferswil, Langnau am Albis, Horgen, Baar, Neuheim",7
5,Hedingen,Zürich,3778,89,1229963,325.55929062996296,7191168.0079595875,1903.4325060771803,1728,447,"Affoltern am Albis, Bonstetten, Stallikon, Arni (AG), Jonen, Islisberg",6
6,Kappel am Albis,Zürich,1221,40,59618,48.827190827190826,2503262.9527923055,2050.1744085113069,544,139,"Hausen am Albis, Knonau, Mettmenstetten, Rifferswil, Baar, Steinhausen",6
7,Knonau,Zürich,2378,71,128671,54.10891505466779,2971329.1695226007,1249.5076406739279,1041,251,"Kappel am Albis, Maschwanden, Mettmenstetten, Cham, Steinhausen",5
8,Maschwanden,Zürich,645,18,9292,14.406201550387596,541436.83796972781,839.43695809260123,291,85,"Knonau, Mettmenstetten, Obfelden, Cham, Hünenberg",5
9,Mettmenstetten,Zürich,5200,121,1175508,226.05923076923077,7886849.0674618091,1516.7017437426557,2365,604,"Aeugst am Albis, Affoltern am Albis, Kappel am Albis, Knonau, Maschwanden, Obfelden, Rifferswil",7
10,Obfelden,Zürich,5721,142,541587,94.666491872050344,5417909.5647257743,947.02142365421685,2443,704,"Affoltern am Albis, Maschwanden, Mettmenstetten, Ottenbach, Hünenberg, Merenschwand",6
11,Ottenbach,Zürich,2588,85,348839,134.79095826893354,3383458.3814573647,1307.3641350298935,1222,289,"Affoltern am Albis, Obfelden, Jonen, Aristau, Merenschwand",5
12,Rifferswil,Zürich,1129,34,47013,41.641275465013287,1742116.1643615626,1543.0612616134301,463,139,"Aeugst am Albis, Hausen am Albis, Kappel am Albis, Mettmenstetten, Rifferswil",5
13,Stallikon,Zürich,3755,125,190450,50.719041278295606,7866285.0987627152,2094.8828492044513,1723,373,"Aeugst am Albis, Affoltern am Albis, Bonstetten, Hedingen, Wettswil am Albis, Adliswil, Langnau am Albis, Birmensdorf (ZH), Uitikon, Zürich",10
14,Wettswil am Albis,Zürich,5240,203,680183,129.80591603053435,16142074.976115726,3080.54865956407,2391,465,"Bonstetten, Stallikon, Aesch (ZH), Birmensdorf (ZH)",4
21,Adlikon,Zürich,698,17,11312,16.206303724928368,578627,828.97851002865332,319,73,NA,NA
22,Benken (ZH),Zürich,845,27,44351,52.486390532544377,1286211.250957028,1522.1434922568378,391,107,"Benken (ZH), Dachsen, Laufen-Uhwiesen, Marthalen, Rheinau, Trüllikon",6
23,Berg am Irchel,Zürich,577,22,57145,99.038128249566725,2006282.1270225786,3477.0920745625281,303,53,"Buch am Irchel, Flaach, Volken, Freienstein-Teufen, Rüdlingen",5
24,Buch am Irchel,Zürich,979,31,43807,44.746680286006132,1158836.4478321399,1183.6940223004494,420,114,"Berg am Irchel, Dorf, Volken, Freienstein-Teufen, Dättlikon, Neftenbach",6
25,Dachsen,Zürich,1916,58,66422,34.667014613778704,2282436.2373987534,1191.2506458239841,873,234,"Benken (ZH), Laufen-Uhwiesen, Rheinau",3
26,Dorf,Zürich,658,23,13317,20.238601823708208,814451.74114274897,1237.7686035604088,285,80,"Buch am Irchel, Henggart, Volken, Neftenbach, Andelfingen",5
27,Feuerthalen,Zürich,3614,104,727026,201.169341449917,4326560.5704518193,1197.1667322777585,1663,502,"Flurlingen, Laufen-Uhwiesen, Schaffhausen, Schlatt (TG)",4
28,Flaach,Zürich,1420,70,111247,78.342957746478874,1319782.2964654379,929.42415244044923,621,159,"Berg am Irchel, Kleinandelfingen, Marthalen, Volken, Andelfingen, Rüdlingen",6
29,Flurlingen,Zürich,1477,77,81201,54.976980365605961,3016442.169654815,2042.2763504771935,719,183,"Feuerthalen, Laufen-Uhwiesen, Neuhausen am Rheinfall, Schaffhausen",4
30,Andelfingen,Zürich,2247,96,1219361,542.66177125055628,3391421.0162493647,1509.3106436356763,1018,241,NA,NA
31,Henggart,Zürich,2234,61,528279,236.47224709042078,2172879.1161817028,972.64060706432531,1000,275,"Dorf, Dägerlen, Hettlingen, Neftenbach, Andelfingen",5
32,Humlikon,Zürich,485,16,10818,22.305154639175257,691187.29198442551,1425.1284370812898,209,50,NA,NA
33,Kleinandelfingen,Zürich,2074,88,536518,258.68756027000967,2099239.2603757498,1012.1693637298697,931,277,"Flaach, Marthalen, Ossingen, Trüllikon, Andelfingen",5
34,Laufen-Uhwiesen,Zürich,1761,43,815498,463.08801817149345,4003198,2273.2526973310619,841,197,"Benken (ZH), Dachsen, Feuerthalen, Flurlingen, Trüllikon, Neuhausen am Rheinfall, Schlatt (TG)",7
35,Marthalen,Zürich,1918,103,381266,198.78310740354536,2430024.2419305299,1266.9573732693066,910,224,"Benken (ZH), Flaach, Kleinandelfingen, Rheinau, Trüllikon, Rüdlingen",6
37,Ossingen,Zürich,1668,44,149119,89.399880095923265,1359101.140618575,814.80883730130392,754,245,"Kleinandelfingen, Thalheim an der Thur, Trüllikon, Truttikon, Andelfingen, Stammheim, Neunforn",7
38,Rheinau,Zürich,1316,33,109229,83.000759878419458,1153353.7014668079,876.40858774073547,581,181,"Benken (ZH), Dachsen, Marthalen, Rheinau",4
39,Thalheim an der Thur,Zürich,938,37,74584,79.513859275053306,1035253.1788771426,1103.6814273743526,441,108,"Ossingen, Altikon, Dägerlen, Dinhard, Andelfingen, Neunforn",6
40,Trüllikon,Zürich,1061,34,8673,8.1743638077285574,927046.28092937369,873.7476728834813,480,140,"Benken (ZH), Kleinandelfingen, Laufen-Uhwiesen, Marthalen, Ossingen, Truttikon, Schlatt (TG)",7
41,Truttikon,Zürich,463,10,16599,35.850971922246224,437082.74684433854,944.02321132686507,187,83,"Ossingen, Trüllikon, Stammheim, Basadingen-Schlattingen, Schlatt (TG)",5
43,Volken,Zürich,380,15,5990,15.763157894736842,518776.02035001048,1365.2000535526593,160,45,"Berg am Irchel, Buch am Irchel, Dorf, Flaach, Andelfingen",5
51,Bachenbülach,Zürich,4180,177,1023156,244.77416267942584,4690654.9150909269,1122.1662476294084,1841,571,"Bülach, Höri, Winkel, Oberglatt",4
52,Bassersdorf,Zürich,11824,459,3105904,262.67794316644114,13517363.447400497,1143.214093995306,5384,1450,"Dietlikon, Kloten, Nürensdorf, Lindau, Wangen-Brüttisellen",5
53,Bülach,Zürich,21372,652,3472761,162.49115665356541,23268559.691720974,1088.7403935860459,9586,2895,"Bachenbülach, Eglisau, Embrach, Glattfelden, Hochfelden, Höri, Rorbas, Winkel",8
54,Dietlikon,Zürich,7847,445,11520424,1468.1310054798012,10024827.19819708,1277.5362811516604,3632,928,"Bassersdorf, Kloten, Wallisellen, Dübendorf, Wangen-Brüttisellen",5
55,Eglisau,Zürich,5339,141,172563,32.321221202472373,6864578.2198401419,1285.7423150103282,2294,658,"Bülach, Freienstein-Teufen, Glattfelden, Hüntwangen, Rafz, Rorbas, Wil (ZH), Buchberg, Rüdlingen",9
56,Embrach,Zürich,9421,292,1387793,147.3084598237979,9047040.0851952881,960.30570907496951,4002,1266,"Bülach, Freienstein-Teufen, Lufingen, Oberembrach, Rorbas, Winkel, Dättlikon, Pfungen",8
57,Freienstein-Teufen,Zürich,2389,66,287811,120.47341984093764,2793301.7248216104,1169.2347111015531,1085,291,"Berg am Irchel, Buch am Irchel, Eglisau, Embrach, Rorbas, Dättlikon, Buchberg, Rüdlingen",8
58,Glattfelden,Zürich,5217,131,707593,135.63216407897258,4427804.1636535265,848.72611915919617,2297,671,"Bülach, Eglisau, Hochfelden, Hüntwangen, Stadel, Weiach",6
59,Hochfelden,Zürich,1982,35,48983,24.713925327951564,2447931.6368983681,1235.0815524209729,853,239,"Bülach, Glattfelden, Höri, Neerach, Stadel",5
60,Höri,Zürich,2872,160,1016297,353.86385793871864,1830028.1881352712,637.19644433679355,1178,415,"Bachenbülach, Bülach, Hochfelden, Neerach, Niederglatt, Oberglatt",6
61,Hüntwangen,Zürich,1057,43,112071,106.02743614001892,1413256.1391479524,1337.0445971125378,473,120,"Eglisau, Glattfelden, Wasterkingen, Wil (ZH)",4
62,Kloten,Zürich,20130,1040,74135475,3682.8353204172877,22129999.301374309,1099.3541630091559,9159,2806,"Bassersdorf, Dietlikon, Lufingen, Nürensdorf, Oberembrach, Opfikon, Wallisellen, Winkel, Rümlang",9
63,Lufingen,Zürich,2417,81,339591,140.50103434009102,4185897.7161382004,1731.8567298875466,1125,225,"Embrach, Kloten, Oberembrach, Winkel",4
64,Nürensdorf,Zürich,5602,221,534561,95.423241699393074,12253913.857523918,2187.417682528368,2772,625,"Bassersdorf, Kloten, Oberembrach, Lindau, Brütten",5
65,Oberembrach,Zürich,1121,35,54101,48.261373773416594,1377185.4855820963,1228.53299338278,550,114,"Embrach, Kloten, Lufingen, Nürensdorf, Brütten, Pfungen, Winterthur",7
66,Opfikon,Zürich,21014,1342,111835715,5321.9622632530691,22216507.733896665,1057.2241236269469,9040,2727,"Kloten, Wallisellen, Rümlang, Zürich",4
67,Rafz,Zürich,4661,127,493895,105.96331259386398,5131797.9518329296,1101.0079278766209,2026,561,"Eglisau, Wil (ZH), Buchberg, Rüdlingen",4
68,Rorbas,Zürich,2885,77,112314,38.930329289428073,1910421.5275735073,662.19117073605105,1138,398,"Bülach, Eglisau, Embrach, Freienstein-Teufen, Rorbas",5
69,Wallisellen,Zürich,16841,1042,90632769,5381.6738317202071,27598279.84857332,1638.7554093327783,8055,1893,"Dietlikon, Kloten, Opfikon, Dübendorf, Zürich",5
70,Wasterkingen,Zürich,563,14,6601,11.724689165186501,506596.93797962111,899.81694134923816,264,68,"Hüntwangen, Wil (ZH)",2
71,Wil (ZH),Zürich,1474,61,108414,73.550881953867034,2284008.5022603311,1549.5308699188136,646,174,"Eglisau, Hüntwangen, Rafz, Wasterkingen, Wil (ZH)",5
72,Winkel,Zürich,4535,208,750814,165.55986769570012,15000142.178427044,3307.6388486057431,2349,446,"Bachenbülach, Bülach, Embrach, Kloten, Lufingen, Oberglatt, Rümlang",7
81,Bachs,Zürich,592,19,10293,17.386824324324323,611479.44122475071,1032.9044615282951,287,64,"Neerach, Oberweningen, Schöfflisdorf, Stadel, Steinmaur, Weiach, Fisibach, Siglistorf",8
82,Boppelsen,Zürich,1432,52,262518,183.32262569832403,4625778.305944928,3230.2921130900336,654,140,"Buchs (ZH), Otelfingen, Regensberg, Schleinikon",4
83,Buchs (ZH),Zürich,6565,192,1351641,205.8859101294745,6843909.6688675517,1042.4843364611656,2871,842,"Boppelsen, Buchs (ZH), Dällikon, Dänikon, Dielsdorf, Niederhasli, Otelfingen, Regensberg, Regensdorf",9
84,Dällikon,Zürich,4177,216,2829984,677.51592051711759,4062063.3805840635,972.48345237827709,1846,523,"Buchs (ZH), Dänikon, Regensdorf, Oetwil an der Limmat, Weiningen (ZH)",5
85,Dänikon,Zürich,1861,67,534484,287.20257925846317,2136868.7073419234,1148.2368121128013,763,248,"Buchs (ZH), Dällikon, Hüttikon, Otelfingen, Oetwil an der Limmat",5
86,Dielsdorf,Zürich,5966,234,2997692,502.46262152195777,5323552.2401213069,892.31515925600183,2656,754,"Buchs (ZH), Niederhasli, Regensberg, Steinmaur",4
87,Hüttikon,Zürich,952,30,13657,14.345588235294118,1508227,1584.2720588235295,409,74,"Dänikon, Otelfingen, Oetwil an der Limmat, Würenlos",4
88,Neerach,Zürich,3175,186,909168,286.35212598425198,9610724.8118405379,3026.9999407371774,1712,305,"Hochfelden, Höri, Bachs, Niederglatt, Stadel, Steinmaur",6
89,Niederglatt,Zürich,4993,131,935698,187.40196274784699,4316347.1199260345,864.47969555898953,2244,626,"Höri, Neerach, Niederhasli, Oberglatt, Steinmaur",5
90,Niederhasli,Zürich,9345,266,1820271,194.78555377207061,7714123.2696305066,825.48135576570428,4005,1312,"Buchs (ZH), Dielsdorf, Niederglatt, Oberglatt, Regensdorf, Rümlang, Steinmaur",7
91,Niederweningen,Zürich,3073,76,3784353,1231.4848682069639,4238245.7184675289,1379.1883236145554,1365,380,"Otelfingen, Schleinikon, Wettingen, Ehrendingen, Schneisingen, Siglistorf",6
92,Oberglatt,Zürich,7228,191,1480521,204.83135030437188,4232347.1250631753,585.54885515539229,2983,1045,"Bachenbülach, Höri, Winkel, Niederglatt, Niederhasli, Rümlang",6
93,Oberweningen,Zürich,1790,55,102228,57.110614525139667,2640442.3570157867,1475.1074620199925,831,231,"Bachs, Regensberg, Schleinikon, Schöfflisdorf, Steinmaur, Fisibach, Siglistorf",7
94,Otelfingen,Zürich,2982,200,2441302,818.67940979208583,3425592.3297154489,1148.7566498039735,1284,334,"Boppelsen, Buchs (ZH), Dänikon, Hüttikon, Niederweningen, Schleinikon, Wettingen, Würenlos",8
95,Regensberg,Zürich,469,16,21785,46.449893390191896,964162.32656803005,2055.7832122985715,236,48,"Boppelsen, Buchs (ZH), Dielsdorf, Oberweningen, Schleinikon, Steinmaur",6
96,Regensdorf,Zürich,18540,965,7816253,421.58861920172598,17799543.323625509,960.061667940966,7898,2622,"Buchs (ZH), Dällikon, Niederhasli, Rümlang, Oberengstringen, Unterengstringen, Weiningen (ZH), Zürich",8
97,Rümlang,Zürich,8233,553,6771102,822.43434956880844,7606500.7750387806,923.9038959114273,3605,1098,"Kloten, Opfikon, Winkel, Niederhasli, Oberglatt, Regensdorf, Zürich",7
98,Schleinikon,Zürich,758,30,47737,62.977572559366756,774319.63335431868,1021.529859306489,358,103,"Boppelsen, Niederweningen, Oberweningen, Otelfingen, Regensberg, Siglistorf",6
99,Schöfflisdorf,Zürich,1377,46,18543,13.466230936819173,1902540.8642708901,1381.6564010681846,658,141,"Bachs, Oberweningen, Steinmaur",3
100,Stadel,Zürich,2293,60,58875,25.675970344526821,2303768.5085779158,1004.6962531957766,1098,280,"Glattfelden, Hochfelden, Bachs, Neerach, Weiach",5
101,Steinmaur,Zürich,3609,106,307734,85.268495428096429,3971645.3016406684,1100.4835970187498,1606,404,"Bachs, Dielsdorf, Neerach, Niederglatt, Niederhasli, Oberweningen, Regensberg, Schöfflisdorf, Steinmaur",9
102,Weiach,Zürich,1903,50,559202,293.85286389910669,1322959.935868697,695.19702357787548,875,250,"Glattfelden, Bachs, Stadel, Fisibach, Zurzach",5
111,Bäretswil,Zürich,5053,192,1013669,200.60736196319019,4698263.3218008094,929.79681808842452,2245,706,"Fischenthal, Hinwil, Wetzikon (ZH), Hittnau, Pfäffikon, Bauma",6
112,Bubikon,Zürich,7344,320,3904193,531.61669389978215,8969348.3054703344,1221.3164903962875,3357,895,"Dürnten, Gossau (ZH), Grüningen, Hinwil, Rüti (ZH), Hombrechtikon, Rapperswil-Jona",7
113,Dürnten,Zürich,7606,189,526113,69.170786221404157,6689229.3777974108,879.46744383347504,3305,1033,"Bubikon, Hinwil, Rüti (ZH), Wald (ZH)",4
114,Fischenthal,Zürich,2516,65,156852,62.341812400635931,1478014.3598531685,587.44608897184753,1002,419,"Bäretswil, Hinwil, Wald (ZH), Bauma, Eschenbach (SG), Mosnang, Fischingen",7
115,Gossau (ZH),Zürich,10280,335,1262105,122.77285992217899,12521447.244123347,1218.0396151870959,4709,1256,"Bubikon, Gossau (ZH), Grüningen, Hinwil, Wetzikon (ZH), Egg, Mönchaltorf, Uster",8
116,Grüningen,Zürich,3641,137,634331,174.21889590771767,5092186.8543424467,1398.5682104758162,1682,443,"Bubikon, Gossau (ZH), Hombrechtikon, Oetwil am See, Egg",5
117,Hinwil,Zürich,11277,496,7718284,684.42706393544381,11184044.114161566,991.75703770165524,5285,1537,"Bäretswil, Bubikon, Dürnten, Fischenthal, Gossau (ZH), Wald (ZH), Wetzikon (ZH)",7
118,Rüti (ZH),Zürich,12286,465,1419958,115.57528894676868,9098816.3748546131,740.58410995072552,5399,1912,"Bubikon, Dürnten, Rüti (ZH), Wald (ZH), Rapperswil-Jona, Eschenbach (SG)",6
119,Seegräben,Zürich,1430,54,121101,84.68601398601399,1778456.3864547319,1243.6757947235888,637,192,"Wetzikon (ZH), Pfäffikon, Mönchaltorf, Uster",4
120,Wald (ZH),Zürich,10096,302,890707,88.22375198098257,6910922.1218455015,684.5208123856479,4333,1543,"Dürnten, Fischenthal, Hinwil, Rüti (ZH), Wald (ZH), Eschenbach (SG)",6
121,Wetzikon (ZH),Zürich,24990,1003,7978205,319.25590236094439,21474976.336816341,859.34279058888922,11200,3678,"Bäretswil, Gossau (ZH), Hinwil, Seegräben, Wetzikon (ZH), Pfäffikon, Mönchaltorf",7
131,Adliswil,Zürich,18944,578,8103067,427.73791173986484,34436777.167722188,1817.8197406947945,8681,2268,"Stallikon, Kilchberg (ZH), Langnau am Albis, Rüschlikon, Zürich",5
135,Kilchberg (ZH),Zürich,8923,478,31651603,3547.1929844222796,64071081.393060267,7180.4417116508203,4439,902,"Adliswil, Kilchberg (ZH), Rüschlikon, Zürich",4
136,Langnau am Albis,Zürich,7727,212,738755,95.606962598679956,14988687.92386142,1939.781017712103,3373,1002,"Aeugst am Albis, Hausen am Albis, Stallikon, Adliswil, Rüschlikon, Thalwil, Horgen",7
137,Oberrieden,Zürich,5002,160,464970,92.956817273090763,17563492.374613196,3511.2939573397034,2514,524,"Thalwil, Horgen",2
138,Richterswil,Zürich,13632,432,2943348,215.91461267605635,23311856.201353904,1710.0833481040129,6265,1668,"Wädenswil, Wollerau",2
139,Rüschlikon,Zürich,6092,361,9745055,1599.6478988837821,44381641.730296992,7285.2333766081729,2860,657,"Adliswil, Kilchberg (ZH), Langnau am Albis, Thalwil",4
141,Thalwil,Zürich,18139,865,4752566,262.00815921495121,55382803.852593876,3053.2446029325693,8918,1957,"Langnau am Albis, Oberrieden, Rüschlikon, Horgen",4
151,Erlenbach (ZH),Zürich,5592,370,1522164,272.2038626609442,48237906.229619883,8626.2350196029838,2568,721,"Erlenbach (ZH), Herrliberg, Küsnacht (ZH)",3
152,Herrliberg,Zürich,6460,364,1701818,263.43931888544893,47351432.414101124,7329.943098158069,3006,831,"Erlenbach (ZH), Küsnacht (ZH), Meilen, Egg, Maur",5
153,Hombrechtikon,Zürich,8775,299,1683812,191.88740740740741,10467559.393139124,1192.884261326396,3933,1199,"Bubikon, Grüningen, Oetwil am See, Stäfa, Rapperswil-Jona",5
154,Küsnacht (ZH),Zürich,14564,1058,19947925,1369.6735100247186,120537449.68999502,8276.3972596810636,6982,1708,"Erlenbach (ZH), Herrliberg, Küsnacht (ZH), Zumikon, Zollikon, Maur",6
155,Männedorf,Zürich,11359,380,8470186,745.68060568712031,28115115.750332925,2475.1400431669094,5438,1309,"Oetwil am See, Stäfa, Uetikon am See",3
156,Meilen,Zürich,14335,778,3513759,245.11747471224277,66824659.724425018,4661.6435105981873,6891,1676,"Herrliberg, Uetikon am See, Egg",3
157,Oetwil am See,Zürich,4840,160,1755477,362.70185950413224,3728344.5795399775,770.31912800412761,2005,661,"Grüningen, Hombrechtikon, Männedorf, Stäfa, Uetikon am See, Egg",6
158,Stäfa,Zürich,14718,653,49876486,3388.8086696562032,36553502.231323145,2483.5916721920876,7098,1863,"Hombrechtikon, Männedorf, Oetwil am See, Stäfa",4
159,Uetikon am See,Zürich,6201,219,698243,112.60167714884696,22318399.322087575,3599.1613162534391,2859,793,"Männedorf, Meilen, Oetwil am See, Egg",4
160,Zumikon,Zürich,5486,283,1371858,250.06525701786364,39779816.141779572,7251.1513200473155,2545,650,"Küsnacht (ZH), Zollikon, Maur",3
161,Zollikon,Zürich,13067,1040,6075861,464.97750057396496,88723519.903573394,6789.8920872100243,6331,1537,"Küsnacht (ZH), Zumikon, Maur, Zürich",4
172,Fehraltorf,Zürich,6485,309,6096435,940.08249807247489,7233586.7929398064,1115.4335841079117,2939,727,"Pfäffikon, Russikon, Uster, Volketswil, Illnau-Effretikon",5
173,Hittnau,Zürich,3664,127,306683,83.701692139737986,4145004.686558337,1131.2785716589347,1662,479,"Bäretswil, Pfäffikon, Bauma",3
176,Lindau,Zürich,5605,267,2916672,520.36966993755573,6855341.3789308369,1223.0760711741011,2491,684,"Bassersdorf, Nürensdorf, Volketswil, Wangen-Brüttisellen, Brütten, Winterthur, Illnau-Effretikon",7
177,Pfäffikon,Zürich,12164,447,1764831,145.08640249917789,16943473.11444648,1392.9195260150016,5799,1603,"Bäretswil, Seegräben, Wetzikon (ZH), Fehraltorf, Hittnau, Russikon, Wildberg, Uster, Bauma",9
178,Russikon,Zürich,4393,143,1278661,291.06783519235148,6417272.4789776355,1460.7950100108435,1945,498,"Fehraltorf, Pfäffikon, Weisslingen, Wildberg, Illnau-Effretikon",5
180,Weisslingen,Zürich,3364,112,640734,190.46789536266348,4561450.1622570474,1355.960214701857,1530,423,"Russikon, Wildberg, Zell (ZH), Illnau-Effretikon",4
181,Wila,Zürich,1977,74,239282,121.03287809812848,1354941.733807608,685.3524197307072,879,314,"Wildberg, Turbenthal, Bauma, Fischingen",4
182,Wildberg,Zürich,985,29,41494,42.125888324873095,917248.92737856216,931.21718515590067,461,102,"Pfäffikon, Russikon, Weisslingen, Wila, Turbenthal, Zell (ZH), Bauma",7
191,Dübendorf,Zürich,29303,1415,24669399,841.87281165750949,39147711.067240492,1335.9625658547075,13734,3505,"Dietlikon, Wallisellen, Fällanden, Schwerzenbach, Volketswil, Wangen-Brüttisellen, Zürich",7
192,Egg,Zürich,8796,310,800417,90.997839927239653,16743487.437088909,1903.5342697918268,4104,1100,"Gossau (ZH), Grüningen, Herrliberg, Meilen, Oetwil am See, Uetikon am See, Maur, Mönchaltorf",8
193,Fällanden,Zürich,8689,320,7634434,878.63206352859936,14445229.386912171,1662.4731714710749,3955,1118,"Dübendorf, Maur, Schwerzenbach, Zürich",4
194,Greifensee,Zürich,5385,137,7322754,1359.8428969359331,9751051.8052288853,1810.7802795225414,2340,711,"Schwerzenbach, Uster, Volketswil",3
195,Maur,Zürich,10468,433,1410018,134.69793656858999,31530880.303564765,3012.1207779484871,4878,1276,"Herrliberg, Küsnacht (ZH), Zumikon, Zollikon, Egg, Fällanden, Mönchaltorf, Zürich",8
196,Mönchaltorf,Zürich,3898,137,427537,109.68111852231914,4203803.815009594,1078.4514661389414,1724,520,"Gossau (ZH), Seegräben, Wetzikon (ZH), Egg, Maur, Uster",6
197,Schwerzenbach,Zürich,5170,213,4425024,855.90406189555131,5842079.7179799275,1129.9960769787094,2357,650,"Dübendorf, Fällanden, Greifensee, Volketswil",4
198,Uster,Zürich,35007,1390,9409416,268.78669980289658,45925908.151353672,1311.9064230397826,16446,4497,"Gossau (ZH), Seegräben, Fehraltorf, Pfäffikon, Greifensee, Mönchaltorf, Volketswil",7
199,Volketswil,Zürich,18640,882,18349237,984.40112660944203,22163906.05292945,1189.0507539125242,8345,2310,"Fehraltorf, Lindau, Dübendorf, Greifensee, Schwerzenbach, Uster, Wangen-Brüttisellen, Illnau-Effretikon",8
200,Wangen-Brüttisellen,Zürich,7967,481,9759921,1225.0434291452241,11779163.824450217,1478.4942669072695,3537,982,"Bassersdorf, Dietlikon, Lindau, Dübendorf, Volketswil, Wangen-Brüttisellen",6
211,Altikon,Zürich,698,20,35936,51.484240687679083,571291,818.46848137535812,326,82,"Thalheim an der Thur, Dinhard, Ellikon an der Thur, Rickenbach (ZH), Neunforn, Uesslingen-Buch",6
213,Brütten,Zürich,2067,69,149788,72.466376390904699,4486972.3632652285,2170.7655361708894,1012,228,"Nürensdorf, Oberembrach, Lindau, Winterthur",4
214,Dägerlen,Zürich,1037,23,15298,14.752169720347155,1395468,1345.6779170684667,456,137,"Henggart, Thalheim an der Thur, Dinhard, Hettlingen, Seuzach, Andelfingen",6
215,Dättlikon,Zürich,776,24,32789,42.253865979381445,1360042.2518863571,1752.6317678947901,334,72,"Buch am Irchel, Embrach, Freienstein-Teufen, Neftenbach, Pfungen",5
216,Dinhard,Zürich,1684,56,85497,50.770190023752967,2135905.8375891768,1268.3526351479672,791,176,"Thalheim an der Thur, Altikon, Dägerlen, Rickenbach (ZH), Seuzach, Winterthur",6
218,Ellikon an der Thur,Zürich,901,45,250293,277.79467258601557,1057678.9348880458,1173.8944893319042,378,116,"Altikon, Rickenbach (ZH), Wiesendangen, Frauenfeld, Gachnang, Uesslingen-Buch",6
219,Elsau,Zürich,3647,139,1701492,466.54565396216066,3842472.9402270569,1053.5982835829604,1547,508,"Schlatt (ZH), Winterthur, Elgg, Wiesendangen",4
220,Hagenbuch,Zürich,1085,33,79482,73.255299539170508,1141763.4748112164,1052.3165666462824,506,146,"Elgg, Wiesendangen, Aadorf, Frauenfeld",4
221,Hettlingen,Zürich,3169,110,222155,70.102556011360051,6435124,2030.6481539917954,1385,421,"Henggart, Dägerlen, Neftenbach, Seuzach, Winterthur",5
223,Neftenbach,Zürich,5718,214,1967522,344.0926897516614,8263746.5836031595,1445.2162615605387,2530,687,"Buch am Irchel, Dorf, Henggart, Dättlikon, Hettlingen, Pfungen, Winterthur",7
224,Pfungen,Zürich,3900,131,1429672,366.58256410256411,3054507.4522743947,783.20703904471657,1696,518,"Embrach, Oberembrach, Dättlikon, Neftenbach, Winterthur",5
225,Rickenbach (ZH),Zürich,2749,76,192918,70.177519097853761,2468016.3770304527,897.78696872697446,1173,367,"Altikon, Dinhard, Ellikon an der Thur, Rickenbach (ZH), Winterthur, Wiesendangen",6
226,Schlatt (ZH),Zürich,789,13,9901,12.548795944233207,530638.11240120791,672.54513612320397,309,103,"Elsau, Schlatt (ZH), Turbenthal, Winterthur, Zell (ZH), Elgg",6
227,Seuzach,Zürich,7440,270,1741273,234.04206989247311,13274085.2803906,1784.1512473643279,3659,848,"Dägerlen, Dinhard, Hettlingen, Winterthur",4
228,Turbenthal,Zürich,4883,157,560854,114.85848863403645,2920861.0971193775,598.16938298574189,1941,831,"Wila, Wildberg, Schlatt (ZH), Zell (ZH), Elgg, Aadorf, Bichelsee-Balterswil, Fischingen",8
230,Winterthur,Zürich,113173,4402,198159770,1750.9456319086707,104713139.02506541,925.24841636313795,51186,17761,"Oberembrach, Lindau, Brütten, Dinhard, Elsau, Hettlingen, Neftenbach, Pfungen, Rickenbach (ZH), Schlatt (ZH), Seuzach, Zell (ZH), Illnau-Effretikon, Wiesendangen",14
231,Zell (ZH),Zürich,6299,164,475683,75.517224956342275,4461897.9504966261,708.3502064608075,2643,956,"Weisslingen, Wildberg, Schlatt (ZH), Turbenthal, Winterthur, Zell (ZH), Illnau-Effretikon",7
241,Aesch (ZH),Zürich,1669,63,191273,114.60335530257639,3942321.1652759225,2362.0857790748487,811,135,"Bonstetten, Wettswil am Albis, Aesch (ZH), Birmensdorf (ZH), Arni (AG), Oberwil-Lieli, Islisberg",7
242,Birmensdorf (ZH),Zürich,6724,281,827854,123.1192742415229,10151122.466158602,1509.6850782508332,3110,760,"Bonstetten, Stallikon, Wettswil am Albis, Aesch (ZH), Birmensdorf (ZH), Uitikon, Urdorf, Berikon, Oberwil-Lieli, Rudolfstetten-Friedlisberg",10
243,Dietikon,Zürich,27746,1275,11964073,431.1999207092914,17522052.921517555,631.51635989034651,11176,4401,"Geroldswil, Oetwil an der Limmat, Schlieren, Unterengstringen, Urdorf, Weiningen (ZH), Bergdietikon, Spreitenbach",8
244,Geroldswil,Zürich,4934,254,1832524,371.40737738143497,6852546.6280320948,1388.8420405415677,2157,635,"Dietikon, Oetwil an der Limmat, Weiningen (ZH)",3
245,Oberengstringen,Zürich,6738,177,471560,69.985158800831101,9912357.8790525254,1471.1127751636279,3105,938,"Regensdorf, Schlieren, Unterengstringen, Zürich",4
