gde_nr,gde_name,knt_name,einwohner,jur_steuerpflichtige,jur_steuerertrag,jur_kopfquote,nat_steuerertrag,nat_kopfquote,nat_steuerpflichtige,nat_nicht_pflichtige,nachbarn,anzahl_nachbarn
2932,Beringen,Schaffhausen,4925,172,3653631,741.85401015228422,3688835.95,749.00222335025387,2197,625,"Löhningen, Neunkirch, Neuhausen am Rheinfall, Schaffhausen, Siblingen",5
2933,Buchberg,Schaffhausen,854,35,212233,248.51639344262296,2583902.7999999998,3025.647306791569,401,101,"Eglisau, Freienstein-Teufen, Rafz, Rüdlingen",4
2936,Merishausen,Schaffhausen,856,23,28886,33.745327102803735,490038.7,572.47511682242987,347,123,"Büttenhardt, Bargen (SH), Schaffhausen, Beggingen",4
2937,Neuhausen am Rheinfall,Schaffhausen,10467,616,74127450,7082.0149039839498,7747733.5,740.20574185535497,4507,1642,"Flurlingen, Laufen-Uhwiesen, Beringen, Schaffhausen",4
2938,Rüdlingen,Schaffhausen,781,39,82267,105.33546734955186,1418764.6,1816.6000000000001,362,70,"Berg am Irchel, Flaach, Marthalen, Eglisau, Freienstein-Teufen, Rafz, Buchberg, Rüdlingen",8
2939,Schaffhausen,Schaffhausen,36604,1822,340229108,9294.8614359086441,45274257.100000001,1236.8663834553602,17269,5582,"Feuerthalen, Flurlingen, Büttenhardt, Dörflingen, Stetten (SH), Thayngen, Beringen, Merishausen, Neuhausen am Rheinfall, Beggingen, Schleitheim, Siblingen",12
2951,Beggingen,Schaffhausen,463,10,5840,12.613390928725702,246289.15,531.94200863930882,210,71,"Merishausen, Schaffhausen, Schleitheim",3
2952,Schleitheim,Schaffhausen,1653,63,249116,150.70538415003026,1129564.25,683.34195402298849,729,265,"Gächlingen, Schaffhausen, Beggingen, Siblingen, Oberhallau",5
2953,Siblingen,Schaffhausen,880,23,46385,52.710227272727273,783327.05,890.14437500000008,415,108,"Gächlingen, Löhningen, Neunkirch, Beringen, Schaffhausen, Schleitheim, Siblingen",7
2961,Buch (SH),Schaffhausen,332,6,2567,7.7319277108433733,266630.5,803.10391566265059,153,41,"Buch (SH), Ramsen",2
2962,Hemishofen,Schaffhausen,474,14,24193,51.040084388185655,528797.19999999995,1115.6059071729958,228,55,"Ramsen, Stein am Rhein, Wagenhausen",3
2963,Ramsen,Schaffhausen,1465,89,779117,531.82047781569963,962547.45,657.02897610921502,655,220,"Buch (SH), Hemishofen, Diessenhofen, Wagenhausen",4
2964,Stein am Rhein,Schaffhausen,3505,194,1792047,511.28302425106989,3994402.9,1139.6299286733238,1673,494,"Hemishofen, Eschenz, Wagenhausen",3
2971,Hallau,Schaffhausen,2207,99,1232043,558.24331671952882,1390392.15,629.99191209787034,933,347,"Neunkirch, Oberhallau, Trasadingen, Wilchingen",4
2972,Oberhallau,Schaffhausen,438,11,26429,60.340182648401829,257448.9,587.78287671232874,180,61,"Gächlingen, Neunkirch, Schleitheim, Hallau, Oberhallau",5
2973,Trasadingen,Schaffhausen,598,25,64644,108.10033444816054,357928.8,598.54314381270899,259,102,"Hallau, Wilchingen",2
2974,Wilchingen,Schaffhausen,1740,86,208067,119.57873563218391,1171845.05,673.47416666666675,761,268,"Neunkirch, Hallau, Trasadingen, Wilchingen",4
3001,Herisau,Appenzell Ausserrhoden,15763,1371,15316305,971.6618029562901,15642848.25,992.37760895768577,7382,2581,"Hundwil, Schwellbrunn, Stein (AR), Waldstatt, St. Gallen, Degersheim, Flawil, Gossau (SG)",8
3002,Hundwil,Appenzell Ausserrhoden,967,33,50948,52.686659772492241,284700.55,294.41628748707342,346,192,"Herisau, Stein (AR), Urnäsch, Waldstatt, Gonten, Schlatt-Haslen, Schwende-Rüte, Wildhaus-Alt St. Johann, Nesslau",9
3003,Schönengrund,Appenzell Ausserrhoden,528,32,71106,134.67045454545453,224967.75,426.07528409090907,231,79,"Schwellbrunn, Urnäsch, Neckertal",3
3004,Schwellbrunn,Appenzell Ausserrhoden,1541,57,244910,158.92926670992861,884922,574.25178455548348,608,256,"Herisau, Schönengrund, Urnäsch, Waldstatt, Neckertal, Degersheim",6
3005,Stein (AR),Appenzell Ausserrhoden,1387,76,547918,395.03821196827687,1280885,923.49315068493149,609,194,"Herisau, Hundwil, Stein (AR), Teufen (AR), Schlatt-Haslen, St. Gallen",6
3006,Urnäsch,Appenzell Ausserrhoden,2272,87,298708,131.47359154929578,988290.1,434.98683978873237,955,381,"Hundwil, Schönengrund, Schwellbrunn, Waldstatt, Nesslau, Neckertal",6
3007,Waldstatt,Appenzell Ausserrhoden,1817,80,1338736,736.78370941111723,1140044.55,627.43233351678589,804,254,"Herisau, Hundwil, Schwellbrunn, Urnäsch, Waldstatt",5
3021,Bühler,Appenzell Ausserrhoden,1852,98,316563,170.93034557235421,894815.6,483.16177105831531,748,322,"Gais, Speicher, Teufen (AR), Trogen, Schlatt-Haslen",5
3022,Gais,Appenzell Ausserrhoden,3066,192,1920761,626.47129810828437,3314307.7,1080.9875081539465,1393,470,"Bühler, Trogen, Appenzell, Schlatt-Haslen, Schwende-Rüte, Altstätten, Eichberg",7
3023,Speicher,Appenzell Ausserrhoden,4408,238,913319,207.19578039927404,5446005.1500000004,1235.4821120689655,2003,596,"Bühler, Teufen (AR), Trogen, Rehetobel, St. Gallen, Eggersriet",6
3024,Teufen (AR),Appenzell Ausserrhoden,6362,635,16564525,2603.6662999056898,16875161.800000001,2652.49320968249,3184,826,"Stein (AR), Bühler, Speicher, Teufen (AR), Schlatt-Haslen, St. Gallen",6
3025,Trogen,Appenzell Ausserrhoden,1752,108,558595,318.83276255707761,1697809.3,969.06923515981737,747,299,"Bühler, Gais, Speicher, Rehetobel, Wald (AR), Oberegg, Altstätten",7
3031,Grub (AR),Appenzell Ausserrhoden,1013,51,50707,50.056268509378086,730245.05,720.87369200394869,465,172,"Grub (AR), Heiden, Rehetobel, Eggersriet",4
3032,Heiden,Appenzell Ausserrhoden,4203,274,2233836,531.48608137044971,3943912.6,938.35655484177971,1970,629,"Grub (AR), Lutzenberg, Rehetobel, Reute (AR), Wald (AR), Wolfhalden, Oberegg, Eggersriet, Thal",9
3033,Lutzenberg,Appenzell Ausserrhoden,1299,94,322816,248.5111624326405,1259376.25,969.49672825250195,595,198,"Heiden, Walzenhausen, Wolfhalden, Eggersriet, Rorschacherberg, Rheineck, St. Margrethen, Thal",8
3034,Rehetobel,Appenzell Ausserrhoden,1756,97,257889,146.86161731207289,1621881.25,923.62257972665145,760,327,"Speicher, Trogen, Grub (AR), Heiden, Wald (AR), Eggersriet",6
3035,Reute (AR),Appenzell Ausserrhoden,704,43,287568,408.47727272727275,529096.30000000005,751.55724431818192,346,110,"Heiden, Reute (AR), Oberegg, Balgach, Altstätten, Marbach (SG), Rebstein",7
3036,Wald (AR),Appenzell Ausserrhoden,872,43,97019,111.26032110091744,528476,606.05045871559628,394,152,"Trogen, Heiden, Rehetobel, Wald (AR), Oberegg",5
3037,Walzenhausen,Appenzell Ausserrhoden,2012,168,2728581,1356.153578528827,2787875.7,1385.6241053677934,1007,350,"Lutzenberg, Wolfhalden, Oberegg, Au (SG), Berneck, St. Margrethen",6
3038,Wolfhalden,Appenzell Ausserrhoden,1871,111,531021,283.81667557455904,1431359.85,765.02397113842869,860,301,"Heiden, Lutzenberg, Walzenhausen, Oberegg, Thal",5
3101,Appenzell,Appenzell Innerrhoden,5778,799,7416041,1283.4961924541365,11021464.046966564,1907.4877201395923,2759,732,"Gais, Gonten, Schlatt-Haslen, Schwende-Rüte",4
3102,Gonten,Appenzell Innerrhoden,1445,83,436605,302.14878892733566,1380566.9842483525,955.40967768052076,603,232,"Hundwil, Appenzell, Schlatt-Haslen, Schwende-Rüte",4
3103,Rüte,Appenzell Innerrhoden,3692,204,1972842,534.35590465872156,6603507.0435318369,1788.5988741960555,1677,466,NA,NA
3104,Schlatt-Haslen,Appenzell Innerrhoden,1140,52,167575,146.99561403508773,1493128.7667059069,1309.7620760578131,505,157,"Hundwil, Stein (AR), Bühler, Gais, Teufen (AR), Appenzell, Gonten, Schlatt-Haslen",8
3105,Schwende,Appenzell Innerrhoden,2184,304,3563628,1631.6978021978023,2117519.963814741,969.56042299209753,923,346,NA,NA
3111,Oberegg,Appenzell Innerrhoden,1889,102,243562,128.93700370566438,1560743.4447325983,826.22733972080368,881,281,"Trogen, Heiden, Reute (AR), Wald (AR), Walzenhausen, Wolfhalden, Balgach, Berneck, Altstätten, Marbach (SG)",10
3201,Häggenschwil,St. Gallen,1390,54,92764,66.736690647482021,1230507.1000000001,885.2569064748202,548,190,"Muolen, Wittenbach, Waldkirch, Egnach, Roggwil (TG), Hauptwil-Gottshaus, Zihlschlacht-Sitterdorf",7
3202,Muolen,St. Gallen,1220,38,82882,67.936065573770492,742691.6,608.76360655737699,485,180,"Häggenschwil, Egnach, Amriswil, Zihlschlacht-Sitterdorf",4
3203,St. Gallen,St. Gallen,76090,4830,134789956,1771.4542778288869,77326547.849999994,1016.2511216979891,35035,12854,"Herisau, Stein (AR), Speicher, Teufen (AR), Wittenbach, Eggersriet, Mörschwil, Untereggen, Gaiserwald, Gossau (SG)",10
3204,Wittenbach,St. Gallen,9706,271,2374969,244.69080980836597,6758309.1500000004,696.30219967030712,4107,1514,"Häggenschwil, St. Gallen, Berg (SG), Mörschwil, Gaiserwald, Waldkirch, Roggwil (TG)",7
3211,Berg (SG),St. Gallen,851,26,55132,64.784958871915393,1566809.1,1841.1387779083432,344,117,"Wittenbach, Berg (SG), Mörschwil, Steinach, Arbon, Roggwil (TG)",6
3212,Eggersriet,St. Gallen,2339,48,256576,109.69474134245404,1985559.95,848.89266780675496,991,323,"Speicher, Grub (AR), Heiden, Lutzenberg, Rehetobel, St. Gallen, Rorschacherberg, Untereggen",8
3213,Goldach,St. Gallen,9504,323,6672787,702.10300925925924,10626902,1118.150462962963,4461,1335,"Mörschwil, Rorschach, Rorschacherberg, Tübach, Untereggen, Horn",6
3214,Mörschwil,St. Gallen,3658,211,2226030,608.53745215965012,9535622.25,2606.7857435757246,1663,473,"St. Gallen, Wittenbach, Berg (SG), Goldach, Steinach, Tübach, Untereggen",7
3215,Rorschach,St. Gallen,9438,475,11411759,1209.128946810765,5057369.6500000004,535.85183831320194,4032,1681,"Goldach, Rorschacherberg",2
3216,Rorschacherberg,St. Gallen,7382,229,1683466,228.05012191817934,7731578.4500000002,1047.3555201842319,3509,1002,"Lutzenberg, Eggersriet, Goldach, Rorschach, Untereggen, Thal",6
3217,Steinach,St. Gallen,3608,131,5950023,1649.1194567627495,2967615.35,822.50979767184037,1704,464,"Berg (SG), Mörschwil, Tübach, Arbon, Horn",5
3218,Tübach,St. Gallen,1438,112,905433,629.64742698191935,2472876,1719.663421418637,639,163,"Goldach, Mörschwil, Steinach, Horn",4
3219,Untereggen,St. Gallen,1046,37,145888,139.47227533460804,1019241.3,974.418068833652,439,170,"St. Gallen, Eggersriet, Goldach, Mörschwil, Rorschacherberg, Untereggen",6
3231,Au (SG),St. Gallen,7809,480,8155222,1044.3362786528364,7695418.6500000004,985.45507107184028,3639,1114,"Walzenhausen, Au (SG), Balgach, Berneck, St. Margrethen, Widnau",6
3232,Balgach,St. Gallen,4891,243,25159900,5144.1218564710689,8811205.8499999996,1801.5141791044775,2413,596,"Reute (AR), Oberegg, Au (SG), Berneck, Diepoldsau, Widnau, Oberriet (SG), Rebstein",8
3233,Berneck,St. Gallen,3936,229,2480274,630.15091463414637,5229456.95,1328.6221925813009,1781,543,"Walzenhausen, Oberegg, Au (SG), Balgach, Berneck",5
3234,Diepoldsau,St. Gallen,6465,384,3550036,549.11616395978342,6487744.0999999996,1003.5180355761794,2836,877,"Balgach, Widnau, Oberriet (SG)",3
3235,Rheineck,St. Gallen,3398,206,1087084,319.91877575044145,1872850.55,551.16261035903472,1551,588,"Lutzenberg, St. Margrethen, Thal",3
3236,St. Margrethen,St. Gallen,5960,310,2048761,343.75184563758387,2929091.2,491.45825503355707,2552,962,"Lutzenberg, Walzenhausen, Au (SG), Rheineck, St. Margrethen",5
3237,Thal,St. Gallen,6565,427,7878829,1200.1262757044935,9529041,1451.4913937547601,3020,894,"Heiden, Lutzenberg, Wolfhalden, Rorschacherberg, Rheineck, Thal",6
3238,Widnau,St. Gallen,9756,625,15809559,1620.4960024600246,8833207.3000000007,905.41280237802391,4397,1389,"Au (SG), Balgach, Diepoldsau, Widnau",4
3251,Altstätten,St. Gallen,11877,652,7950034,669.36381241054141,13219750.300000001,1113.054668687379,5129,1932,"Gais, Trogen, Reute (AR), Oberegg, Schwende-Rüte, Eichberg, Marbach (SG), Oberriet (SG), Rüthi (SG), Sennwald",10
3252,Eichberg,St. Gallen,1520,41,79455,52.273026315789473,1264733.8500000001,832.06174342105271,628,241,"Gais, Schwende-Rüte, Altstätten, Oberriet (SG)",4
3253,Marbach (SG),St. Gallen,2110,81,642929,304.70568720379146,1921111.35,910.47931279620855,908,303,"Reute (AR), Oberegg, Altstätten, Marbach (SG), Oberriet (SG), Rebstein",6
3254,Oberriet (SG),St. Gallen,8979,376,5103360,568.3661877714668,8438948.1999999993,939.8539035527341,3961,1266,"Schwende-Rüte, Balgach, Diepoldsau, Altstätten, Eichberg, Marbach (SG), Oberriet (SG), Rebstein, Rüthi (SG)",9
3255,Rebstein,St. Gallen,4533,149,2783838,614.12706816677701,3456336.25,762.48317891021395,2046,699,"Reute (AR), Balgach, Marbach (SG), Oberriet (SG), Rebstein",5
3256,Rüthi (SG),St. Gallen,2412,120,978371,405.62645107794361,1524726.35,632.14193615257057,1030,354,"Altstätten, Oberriet (SG), Rüthi (SG)",3
3271,Buchs (SG),St. Gallen,12861,945,13387061,1040.9035844802115,10428409.949999999,810.85529507814317,6017,1798,"Buchs (SG), Gams, Grabs, Sennwald, Sevelen",5
3272,Gams,St. Gallen,3550,126,616566,173.68056338028168,2508762.85,706.69376056338035,1497,563,"Buchs (SG), Grabs, Sennwald, Wildhaus-Alt St. Johann",4
3273,Grabs,St. Gallen,7147,251,1546453,216.37792080593255,6186286.1500000004,865.57802574506786,3134,1139,"Buchs (SG), Gams, Sevelen, Walenstadt, Wildhaus-Alt St. Johann",5
3274,Sennwald,St. Gallen,5665,241,14113150,2491.288614298323,4504702.5,795.18137687555168,2690,833,"Schwende-Rüte, Altstätten, Buchs (SG), Gams, Wildhaus-Alt St. Johann",5
3275,Sevelen,St. Gallen,5112,169,2517228,492.41549295774649,3193703,624.74628325508604,2302,780,"Buchs (SG), Grabs, Wartau, Walenstadt",4
3276,Wartau,St. Gallen,5295,212,1616715,305.32861189801702,2883225.6000000001,544.5185269121813,2183,841,"Sevelen, Flums, Mels, Sargans, Walenstadt",5
3291,Bad Ragaz,St. Gallen,6264,285,2257037,360.31880587484034,5437407.4000000004,868.04077266922104,3057,804,"Mels, Pfäfers, Vilters-Wangs, Fläsch, Maienfeld, Landquart",6
3292,Flums,St. Gallen,4889,212,992053,202.91532010636121,2142893.15,438.30909183882181,2176,816,"Glarus Süd, Wartau, Mels, Quarten, Walenstadt",5
3293,Mels,St. Gallen,8561,301,2221145,259.44924658334304,4919851.45,574.68186543628087,3749,1256,"Glarus Süd, Wartau, Bad Ragaz, Flums, Pfäfers, Sargans, Vilters-Wangs, Fläsch",8
3294,Pfäfers,St. Gallen,1556,44,78505,50.453084832904885,717100.15,460.86127892030851,686,269,"Glarus Süd, Bad Ragaz, Mels, Felsberg, Flims, Tamins, Trin, Chur, Untervaz, Landquart",10
3295,Quarten,St. Gallen,2949,126,491407,166.63513055272975,1890603.15,641.09974567650045,1484,504,"Glarus Nord, Glarus Süd, Flums, Walenstadt, Amden, Wildhaus-Alt St. Johann",6
3296,Sargans,St. Gallen,6200,297,1809902,291.91967741935485,4089168.9,659.54337096774191,2862,904,"Wartau, Mels, Fläsch",3
3297,Vilters-Wangs,St. Gallen,4884,144,1968701,403.09193284193282,3060197.5,626.57606470106475,2081,742,"Bad Ragaz, Mels, Fläsch",3
3298,Walenstadt,St. Gallen,5705,197,614459,107.70534618755478,4309541.45,755.39727432077132,2646,769,"Grabs, Sevelen, Wartau, Flums, Quarten, Wildhaus-Alt St. Johann",6
3311,Amden,St. Gallen,1823,48,82523,45.267690619857376,1846273,1012.7663192539769,957,236,"Quarten, Schänis, Weesen, Ebnat-Kappel, Wildhaus-Alt St. Johann, Nesslau",6
3312,Benken (SG),St. Gallen,2982,83,603997,202.54761904761904,1870247.95,627.17905767940977,1172,445,"Reichenburg, Schübelbach, Tuggen, Glarus Nord, Benken (SG), Kaltbrunn, Schänis, Uznach",8
3313,Kaltbrunn,St. Gallen,4924,173,820056,166.54264825345248,3283523,666.8405767668562,2113,674,"Benken (SG), Schänis, Uznach, Gommiswald, Ebnat-Kappel",5
3315,Schänis,St. Gallen,3876,116,669636,172.76470588235293,1922857.55,496.09327915376679,1643,544,"Glarus Nord, Amden, Benken (SG), Kaltbrunn, Weesen, Ebnat-Kappel, Nesslau",7
3316,Weesen,St. Gallen,1717,68,123668,72.025626092020971,2031341.25,1183.075859056494,833,253,"Glarus Nord, Amden, Schänis, Weesen",4
3338,Schmerikon,St. Gallen,3766,145,1458332,387.23632501327671,3689756.7,979.75483271375469,1669,505,"Tuggen, Uznach, Rapperswil-Jona, Eschenbach (SG)",4
3339,Uznach,St. Gallen,6489,251,9803642,1510.8093697025736,4341800,669.10155648019725,2639,989,"Tuggen, Benken (SG), Kaltbrunn, Schmerikon, Gommiswald, Eschenbach (SG)",6
3340,Rapperswil-Jona,St. Gallen,27277,1312,105064255,3851.7525754298495,51372134.299999997,1883.3498661876306,13143,3457,"Bubikon, Rüti (ZH), Hombrechtikon, Schmerikon, Eschenbach (SG)",5
3341,Gommiswald,St. Gallen,5218,216,960039,183.98600996550402,6142606,1177.1954771943274,2428,763,"Kaltbrunn, Uznach, Eschenbach (SG), Ebnat-Kappel, Wattwil",5
3342,Eschenbach (SG),St. Gallen,9584,349,2654484,276.97036727879799,8322968.0499999998,868.42321055926539,4133,1390,"Fischenthal, Rüti (ZH), Wald (ZH), Schmerikon, Uznach, Rapperswil-Jona, Gommiswald, Eschenbach (SG), Wattwil, Mosnang",10
3352,Ebnat-Kappel,St. Gallen,5001,152,2806049,561.09758048390324,2451250.65,490.15209958008398,2131,854,"Amden, Kaltbrunn, Schänis, Gommiswald, Nesslau, Wattwil, Neckertal",7
3359,Wildhaus-Alt St. Johann,St. Gallen,2606,155,408652,156.81197237145051,1263517.75,484.84948196469685,1195,473,"Hundwil, Schwende-Rüte, Gams, Grabs, Sennwald, Quarten, Walenstadt, Amden, Nesslau",9
3360,Nesslau,St. Gallen,3545,138,481550,135.83921015514809,2045992,577.14866008462627,1586,612,"Hundwil, Urnäsch, Amden, Schänis, Ebnat-Kappel, Wildhaus-Alt St. Johann, Neckertal",7
3372,Hemberg,St. Gallen,902,21,20334,22.543237250554323,391597.4,434.14345898004439,332,160,NA,NA
3374,Lichtensteig,St. Gallen,1896,94,278285,146.77478902953587,946445.1,499.17990506329113,901,320,"Wattwil, Bütschwil-Ganterschwil, Neckertal",3
3375,Oberhelfenschwil,St. Gallen,1251,36,225445,180.21183053557155,645589.05000000005,516.05839328537172,483,223,NA,NA
3378,Neckertal,St. Gallen,4044,144,345338,85.395153313550935,1547118,382.57121661721067,1654,791,NA,NA
3379,Wattwil,St. Gallen,8761,348,2461968,281.01449606209337,5108111.5999999996,583.05120420043374,3775,1494,"Gommiswald, Eschenbach (SG), Ebnat-Kappel, Lichtensteig, Mosnang, Bütschwil-Ganterschwil, Neckertal",7
3392,Kirchberg (SG),St. Gallen,9100,338,3969636,436.22373626373627,7203661.2999999998,791.61113186813179,3498,1325,"Kirchberg (SG), Lütisburg, Mosnang, Jonschwil, Fischingen, Rickenbach (TG), Sirnach, Wilen (TG)",8
3393,Lütisburg,St. Gallen,1606,60,392335,244.29327521793275,873587.55,543.95239726027398,642,244,"Kirchberg (SG), Mosnang, Bütschwil-Ganterschwil, Neckertal, Degersheim, Jonschwil, Oberuzwil",7
3394,Mosnang,St. Gallen,2847,90,273962,96.228310502283108,1348009.35,473.48414120126455,1118,443,"Fischenthal, Bauma, Eschenbach (SG), Wattwil, Kirchberg (SG), Lütisburg, Bütschwil-Ganterschwil, Fischingen",8
3395,Bütschwil-Ganterschwil,St. Gallen,4987,225,1490124,298.80168437938642,3244530.65,650.59768397834364,2066,812,"Lichtensteig, Wattwil, Lütisburg, Mosnang, Neckertal",5
3401,Degersheim,St. Gallen,4121,137,1725053,418.60058238291674,1948670.25,472.86344333899541,1570,659,"Herisau, Schwellbrunn, Lütisburg, Neckertal, Flawil, Oberuzwil",6
3402,Flawil,St. Gallen,10425,377,5711374,547.85362110311746,6736741.7000000002,646.21023501199045,4419,1619,"Herisau, Degersheim, Oberuzwil, Oberbüren, Gossau (SG)",5
3405,Jonschwil,St. Gallen,3834,133,2578926,672.64632237871672,3019974.3,787.68239436619717,1581,516,"Kirchberg (SG), Lütisburg, Oberuzwil, Uzwil, Wil (SG), Rickenbach (TG)",6
3407,Oberuzwil,St. Gallen,6403,236,1056631,165.02124004372951,5692441.4500000002,889.02724504138689,2700,928,"Lütisburg, Degersheim, Flawil, Jonschwil, Uzwil, Oberbüren",6
3408,Uzwil,St. Gallen,13129,381,5468346,416.50894965343895,8639848.8499999996,658.07364231853148,5476,1928,"Jonschwil, Oberuzwil, Oberbüren, Zuzwil (SG), Wil (SG)",5
3422,Niederbüren,St. Gallen,1505,50,270656,179.83787375415284,957336.85,636.10421926910294,618,185,"Niederhelfenschwil, Oberbüren, Gossau (SG), Waldkirch, Bischofszell",5
3423,Niederhelfenschwil,St. Gallen,3136,117,520969,166.12531887755102,2724364.2,868.73858418367354,1253,403,"Niederbüren, Oberbüren, Zuzwil (SG), Bischofszell, Kradolf-Schönenberg, Wuppenau",6
3424,Oberbüren,St. Gallen,4542,234,3044328,670.26155878467637,4770382.75,1050.2824196389256,2048,527,"Flawil, Oberuzwil, Uzwil, Niederbüren, Niederhelfenschwil, Zuzwil (SG), Gossau (SG)",7
3426,Zuzwil (SG),St. Gallen,4792,293,1632908,340.75709515859768,7313682.75,1526.227618948247,2256,553,"Uzwil, Niederhelfenschwil, Oberbüren, Zuzwil (SG), Wil (SG), Wuppenau",6
3427,Wil (SG),St. Gallen,24159,1197,23396339,968.43159899002444,25737461.600000001,1065.3363798170456,10936,3669,"Jonschwil, Uzwil, Zuzwil (SG), Wil (SG), Bettwiesen, Braunau, Münchwilen (TG), Rickenbach (TG), Sirnach, Tobel-Tägerschen, Wilen (TG), Wuppenau",12
3441,Andwil (SG),St. Gallen,1999,70,346932,173.5527763881941,2109880.9500000002,1055.4682091045524,806,254,"Andwil (SG), Gaiserwald, Gossau (SG), Waldkirch",4
3442,Gaiserwald,St. Gallen,8327,276,1292125,155.1729314278852,11534755.15,1385.2233877747087,3830,1045,"St. Gallen, Wittenbach, Andwil (SG), Gossau (SG), Waldkirch",5
3443,Gossau (SG),St. Gallen,18108,775,11921047,658.33040645018775,17482293.550000001,965.44585542301752,8439,2529,"Herisau, St. Gallen, Flawil, Niederbüren, Oberbüren, Andwil (SG), Gaiserwald, Gossau (SG), Waldkirch",9
3444,Waldkirch,St. Gallen,3533,143,824619,233.40475516558166,2918302.9,826.01270874610805,1387,516,"Häggenschwil, Wittenbach, Niederbüren, Andwil (SG), Gaiserwald, Gossau (SG), Bischofszell, Hauptwil-Gottshaus",8
3506,Vaz/Obervaz,Graubünden / Grigioni / Grischun,2786,209,943551,338.6758793969849,5003356.7535703145,1795.8925892212185,1786,558,"Lantsch/Lenz, Albula/Alvra, Scharans, Sils im Domleschg, Thusis, Domleschg, Churwalden, Arosa, Tschiertschen-Praden",9
3513,Lantsch/Lenz,Graubünden / Grigioni / Grischun,539,35,153116,284.07421150278293,517342.54320490727,959.81918961949395,322,101,"Vaz/Obervaz, Albula/Alvra, Arosa",3
3514,Schmitten (GR),Graubünden / Grigioni / Grischun,221,*,5522,24.986425339366516,121983.35251618967,551.96087111398037,116,58,"Schmitten (GR), Albula/Alvra, Bergün Filisur, Davos, Arosa",5
3542,Albula/Alvra,Graubünden / Grigioni / Grischun,1283,48,158254,123.34684333593141,624340.06433036644,486.62514756848515,663,284,"Vaz/Obervaz, Lantsch/Lenz, Schmitten (GR), Surses, Bergün Filisur, Thusis, Zillis-Reischen, Arosa",8
3543,Surses,Graubünden / Grigioni / Grischun,2327,129,492553,211.66867211001289,1372632.8567486412,589.87230629507576,1308,570,"Albula/Alvra, Bergün Filisur, Avers, Andeer, Zillis-Reischen, Ferrera, Bever, Sils im Engadin/Segl, Silvaplana, Bregaglia",10
3544,Bergün Filisur,Graubünden / Grigioni / Grischun,898,55,205513,228.85634743875278,422239.54957858834,470.19994385143468,404,195,"Schmitten (GR), Albula/Alvra, Surses, Bever, La Punt Chamues-ch, Samedan, S-chanf, Zuoz, Davos",9
3551,Brusio,Graubünden / Grigioni / Grischun,1120,58,1334242,1191.2874999999999,459084.71925742028,409.89707076555379,486,281,Poschiavo,1
3561,Poschiavo,Graubünden / Grigioni / Grischun,3493,185,1275678,365.2098482679645,1712231.6881126184,490.18943261168579,1450,697,"Brusio, Pontresina",2
3572,Falera,Graubünden / Grigioni / Grischun,620,18,103554,167.0225806451613,826409.26945461333,1332.9181765396988,399,135,"Laax, Sagogn, Schluein, Ilanz/Glion",4
3575,Laax,Graubünden / Grigioni / Grischun,1885,121,262793,139.41273209549072,3636908.591913356,1929.3944784686239,1447,393,"Glarus Süd, Falera, Sagogn, Schluein, Ilanz/Glion, Flims",6
3581,Sagogn,Graubünden / Grigioni / Grischun,728,15,6725,9.2376373626373631,434071.45782266598,596.25200250366208,368,136,"Falera, Laax, Schluein, Ilanz/Glion, Safiental, Flims",6
3582,Schluein,Graubünden / Grigioni / Grischun,612,42,169255,276.56045751633985,367044.85085791338,599.74648832992386,287,97,"Falera, Laax, Sagogn, Ilanz/Glion",4
3603,Vals,Graubünden / Grigioni / Grischun,979,53,322671,329.5924412665986,505279.98737134901,516.11847535377831,477,159,"Lumnezia, Ilanz/Glion, Safiental, Rheinwald, Blenio",5
3618,Lumnezia,Graubünden / Grigioni / Grischun,2019,93,298582,147.88608221892025,970347.97645000042,480.6082102278358,1025,390,"Vals, Ilanz/Glion, Safiental, Medel (Lucmagn), Sumvitg, Obersaxen Mundaun, Blenio",7
3619,Ilanz/Glion,Graubünden / Grigioni / Grischun,4757,209,1646117,346.04099222198863,3920380.7413104768,824.12880834779833,1984,923,"Glarus Süd, Falera, Laax, Sagogn, Schluein, Vals, Lumnezia, Safiental, Breil/Brigels, Obersaxen Mundaun",10
3633,Fürstenau,Graubünden / Grigioni / Grischun,357,10,111444,312.16806722689074,450857.59279644612,1262.9064223990088,158,52,"Scharans, Sils im Domleschg, Cazis, Thusis, Domleschg",5
3637,Rothenbrunnen,Graubünden / Grigioni / Grischun,304,9,14689,48.319078947368418,136125.91127207715,447.78260286867481,127,48,"Cazis, Domleschg, Domat/Ems, Rhäzüns",4
3638,Scharans,Graubünden / Grigioni / Grischun,790,22,72190,91.379746835443044,617157.63577468658,781.21219718314762,342,150,"Vaz/Obervaz, Fürstenau, Sils im Domleschg, Domleschg",4
3640,Sils im Domleschg,Graubünden / Grigioni / Grischun,960,29,77731,80.969791666666666,407026.20156113041,423.98562662617752,365,154,"Vaz/Obervaz, Fürstenau, Scharans, Thusis, Rongellen, Zillis-Reischen",6
3661,Cazis,Graubünden / Grigioni / Grischun,2264,63,403304,178.13780918727915,958315.68658972241,423.2843138647184,875,405,"Fürstenau, Rothenbrunnen, Flerden, Masein, Thusis, Tschappina, Safiental, Domleschg, Rhäzüns",9
3662,Flerden,Graubünden / Grigioni / Grischun,247,6,7868,31.854251012145749,77189.712061412065,312.50895571421887,94,49,"Cazis, Masein, Tschappina, Urmein, Safiental, Muntogna da Schons",6
3663,Masein,Graubünden / Grigioni / Grischun,498,8,15267,30.656626506024097,254340.62828774954,510.7241531882521,207,67,"Cazis, Flerden, Thusis, Urmein",4
3668,Thusis,Graubünden / Grigioni / Grischun,3278,159,701319,213.94722391702257,1439572.8404105573,439.16194033268988,1287,536,"Vaz/Obervaz, Albula/Alvra, Fürstenau, Sils im Domleschg, Cazis, Masein, Urmein, Rongellen, Zillis-Reischen, Muntogna da Schons",10
3669,Tschappina,Graubünden / Grigioni / Grischun,133,9,2147,16.142857142857142,22037.803165029909,165.69776815811963,51,32,"Cazis, Flerden, Urmein, Safiental, Muntogna da Schons",5
3670,Urmein,Graubünden / Grigioni / Grischun,147,*,1301,8.850340136054422,99916.327032130546,679.70290498047996,79,20,"Flerden, Masein, Thusis, Tschappina, Muntogna da Schons",5
