gde_nr,gde_name,knt_name,einwohner,jur_steuerpflichtige,jur_steuerertrag,jur_kopfquote,nat_steuerertrag,nat_kopfquote,nat_steuerpflichtige,nat_nicht_pflichtige,nachbarn,anzahl_nachbarn
1132,Hergiswil bei Willisau,Luzern,1905,59,214630,112.66666666666667,571655.20915294578,300.08147462096889,725,340,"Trub, Romoos, Luthern, Menznau, Willisau",5
1135,Luthern,Luzern,1238,46,154697,124.95718901453958,276710.20096433011,223.5138941553555,462,238,"Trub, Eriswil, Sumiswald, Hergiswil bei Willisau, Ufhusen, Willisau",6
1136,Menznau,Luzern,2888,105,2723271,942.96087257617728,1569709.5704166249,543.52824460409454,1181,472,"Romoos, Buttisholz, Grosswangen, Ruswil, Wolhusen, Hergiswil bei Willisau, Willisau",7
1137,Nebikon,Luzern,2695,121,1579610,586.12615955473098,2655864.0358250006,985.47830642857161,1096,331,"Altishofen, Dagmersellen, Egolzwil, Schötz",4
1139,Pfaffnau,Luzern,2665,123,540062,202.64990619136961,1669418.0859704835,626.423296799431,1191,347,"Langenthal, Melchnau, Roggwil (BE), Altbüron, Grossdietwil, Reiden, Roggliswil, Brittnau, Murgenthal",9
1140,Reiden,Luzern,7186,372,24447664,3402.1241302532703,3838448.8138803365,534.15652851104039,3029,979,"Triengen, Altishofen, Dagmersellen, Grossdietwil, Pfaffnau, Wikon, Brittnau, Reitnau, Wiliberg",9
1142,Roggliswil,Luzern,698,43,198394,284.23209169054439,276604.58581379842,396.28164156704645,297,111,"Altbüron, Grossdietwil, Pfaffnau, Roggliswil",4
1143,Schötz,Luzern,4530,196,1799843,397.31633554083885,2263025.6318567139,499.56415714276244,1865,666,"Alberswil, Altishofen, Egolzwil, Ettiswil, Fischbach, Nebikon, Wauwil, Zell (LU), Willisau",9
1145,Ufhusen,Luzern,888,47,45827,51.606981981981981,291310.26580795436,328.05210113508372,360,161,"Gondiswil, Eriswil, Huttwil, Fischbach, Luthern, Zell (LU), Willisau",7
1146,Wauwil,Luzern,2261,87,543151,240.22600619195046,1572734.0141286014,695.5922220825305,946,280,"Mauensee, Dagmersellen, Egolzwil, Ettiswil, Schötz, Wauwil",6
1147,Wikon,Luzern,1520,69,465911,306.52039473684209,1090307.2602745299,717.30740807534869,631,221,"Reiden, Bottenwil, Brittnau, Reitnau, Wiliberg, Zofingen",6
1150,Zell (LU),Luzern,2097,118,1167578,556.78493085360037,1030693.3847340805,491.50852872392966,862,347,"Altishofen, Fischbach, Schötz, Ufhusen, Zell (LU), Willisau",6
1151,Willisau,Luzern,7811,374,4385153,561.40737421584947,4952738.3670248613,634.07225285172979,3279,1187,"Grosswangen, Alberswil, Ettiswil, Hergiswil bei Luthern, Menznau, Schötz, Ufhusen, Zell (LU), Willisau",9
1201,Altdorf (UR),Uri,9537,501,9701502,1017.2488203837685,9660652.9000000004,1012.9655971479501,4426,1202,"Altdorf (UR), Attinghausen, Bürglen (UR), Flüelen, Schattdorf, Seedorf (UR)",6
1202,Andermatt,Uri,1433,158,1159392,809.06629448708998,3912017.05,2729.9490928122818,775,207,"Göschenen, Gurtnellen, Hospental, Tujetsch, Airolo",5
1203,Attinghausen,Uri,1750,47,331915,189.66571428571427,1190434.25,680.24814285714285,749,223,"Altdorf (UR), Bürglen (UR), Erstfeld, Isenthal, Schattdorf, Seedorf (UR), Wassen, Engelberg",8
1204,Bauen,Uri,165,*,494,2.9939393939393941,206976.25,1254.4015151515152,84,30,NA,NA
1205,Bürglen (UR),Uri,3995,94,472329,118.23003754693367,2217469.7000000002,555.06125156445557,1746,585,"Altdorf (UR), Attinghausen, Bürglen (UR), Flüelen, Schattdorf, Sisikon, Spiringen, Unterschächen, Muotathal, Riemenstalden",10
1206,Erstfeld,Uri,3845,104,655103,170.3778933680104,1572190.5,408.89219765929778,1615,506,"Attinghausen, Gurtnellen, Schattdorf, Silenen, Wassen",5
1207,Flüelen,Uri,1961,90,697136,355.5002549719531,2405910.1,1226.8791942886282,892,254,"Altdorf (UR), Bürglen (UR), Seedorf (UR), Sisikon",4
1208,Göschenen,Uri,431,20,277706,644.32946635730855,179557.1,416.60580046403715,189,58,"Innertkirchen, Andermatt, Gurtnellen, Hospental, Realp, Wassen, Obergoms",7
1209,Gurtnellen,Uri,528,19,191108,361.94696969696969,145666.9,275.88428030303027,233,96,"Andermatt, Erstfeld, Göschenen, Silenen, Wassen, Tujetsch",6
1210,Hospental,Uri,180,8,19790,109.94444444444444,83704.800000000003,465.0266666666667,83,35,"Andermatt, Göschenen, Realp, Airolo",4
1211,Isenthal,Uri,474,15,20760,43.797468354430379,96487.65,203.56044303797466,165,104,"Attinghausen, Seedorf (UR), Seelisberg, Engelberg, Beckenried, Emmetten, Wolfenschiessen",7
1212,Realp,Uri,150,9,4692,31.28,160102.65,1067.3509999999999,77,15,"Göschenen, Hospental, Airolo, Bedretto, Obergoms",5
1213,Schattdorf,Uri,5413,179,1315054,242.9436541658969,3700579.4,683.64666543506371,2370,685,"Altdorf (UR), Attinghausen, Bürglen (UR), Erstfeld, Silenen, Spiringen, Unterschächen",7
1214,Seedorf (UR),Uri,1886,58,477865,253.37486744432661,1214658.95,644.03974019088014,716,220,"Altdorf (UR), Attinghausen, Flüelen, Isenthal, Seedorf (UR), Seelisberg",6
1215,Seelisberg,Uri,678,33,72491,106.9188790560472,479041,706.55014749262534,353,116,"Isenthal, Seedorf (UR), Emmetten",3
1216,Silenen,Uri,1957,52,168926,86.318855390904446,765888.15,391.35827797649466,863,270,"Erstfeld, Gurtnellen, Schattdorf, Spiringen, Unterschächen, Glarus Süd, Disentis/Mustér, Tujetsch",8
1217,Sisikon,Uri,383,12,43155,112.67624020887729,304722.45,795.61997389033945,164,49,"Bürglen (UR), Flüelen, Morschach, Riemenstalden",4
1218,Spiringen,Uri,830,22,46437,55.948192771084337,214444.25,258.36656626506021,312,168,"Bürglen (UR), Schattdorf, Silenen, Unterschächen, Muotathal, Glarus Süd",6
1219,Unterschächen,Uri,702,19,24639,35.098290598290596,205889.9,293.29045584045582,269,125,"Bürglen (UR), Schattdorf, Silenen, Spiringen, Muotathal",5
1220,Wassen,Uri,405,16,347656,858.40987654320986,145545.35,359.37123456790124,170,64,"Innertkirchen, Attinghausen, Erstfeld, Göschenen, Gurtnellen, Engelberg",6
1301,Einsiedeln,Schwyz,16106,877,7562749,469.56097106668324,17807766.47250225,1105.6604043525549,7375,2364,"Feusisberg, Freienbach, Altendorf, Innerthal, Vorderthal, Alpthal, Oberiberg, Rothenthurm, Unteriberg, Oberägeri",10
1311,Gersau,Schwyz,2326,158,429436,184.62424763542563,4149572.7483618297,1783.9951626663069,1114,384,"Vitznau, Arth, Ingenbohl, Lauerz",4
1321,Feusisberg,Schwyz,5350,1368,33224771,6210.2375700934581,78549087.829575554,14682.072491509449,2781,595,"Wädenswil, Einsiedeln, Freienbach, Wollerau, Oberägeri",5
1322,Freienbach,Schwyz,16506,3950,108531856,6575.2972252514237,146023172.66946808,8846.6722809565053,8484,1844,"Einsiedeln, Feusisberg, Wollerau, Altendorf",4
1323,Wollerau,Schwyz,7299,1858,30859969,4227.972187970955,116657723.79741772,15982.699520128472,3821,796,"Richterswil, Wädenswil, Feusisberg, Freienbach, Wollerau",5
1331,Küssnacht (SZ),Schwyz,13300,989,14494244,1089.7927819548872,42834837.969835646,3220.6645090101988,6492,1570,"Adligenswil, Greppen, Meggen, Meierskappel, Udligenswil, Weggis, Küssnacht (SZ), Arth",8
1341,Altendorf,Schwyz,7059,872,7527418,1066.3575577277234,28530803.693924148,4041.7628125689398,3506,772,"Einsiedeln, Freienbach, Galgenen, Lachen, Vorderthal",5
1342,Galgenen,Schwyz,5227,211,654458,125.20719341878707,7554824.3962147431,1445.3461634235207,2390,632,"Altendorf, Lachen, Schübelbach, Vorderthal, Wangen (SZ)",5
1343,Innerthal,Schwyz,177,9,2398,13.548022598870057,121569.02893769974,686.83067196440527,84,NA,"Einsiedeln, Schübelbach, Vorderthal, Muotathal, Unteriberg, Glarus Nord, Glarus",7
1344,Lachen,Schwyz,8883,913,86653900,9755.0264550264546,23012424.047455676,2590.6139871052205,4427,1016,"Altendorf, Galgenen, Wangen (SZ)",3
1345,Reichenburg,Schwyz,3825,154,663041,173.34405228758169,4097105.9258456738,1071.1388041426599,1668,471,"Schübelbach, Glarus Nord, Benken (SG)",3
1346,Schübelbach,Schwyz,9190,419,2919528,317.68531011969532,7640658.514321669,831.41006684675392,4144,1255,"Galgenen, Innerthal, Reichenburg, Tuggen, Vorderthal, Wangen (SZ), Glarus Nord, Benken (SG)",8
1347,Tuggen,Schwyz,3293,208,1243482,377.61372608563619,5013500.8747855034,1522.4721757623759,1582,398,"Schübelbach, Wangen (SZ), Benken (SG), Schmerikon, Uznach",5
1348,Vorderthal,Schwyz,992,28,53179,53.607862903225808,555591.34006178821,560.07191538486711,470,160,"Einsiedeln, Altendorf, Galgenen, Innerthal, Schübelbach, Vorderthal",6
1349,Wangen (SZ),Schwyz,5150,388,1154940,224.26019417475729,6374876.9369789846,1237.840181937667,2506,639,"Galgenen, Lachen, Schübelbach, Tuggen, Wangen (SZ)",5
1361,Alpthal,Schwyz,621,25,34197,55.067632850241544,792142.23136886128,1275.5913548612903,312,NA,"Einsiedeln, Oberiberg, Rothenthurm, Schwyz",4
1362,Arth,Schwyz,12154,485,2496209,205.3816850419615,11424828.594350653,940.00564376753766,5353,1701,"Vitznau, Weggis, Gersau, Küssnacht (SZ), Lauerz, Steinen, Steinerberg, Walchwil, Zug",9
1363,Illgau,Schwyz,797,18,21555,27.04516938519448,287815.28188980214,361.12331479272541,280,144,"Muotathal, Oberiberg, Schwyz",3
1364,Ingenbohl,Schwyz,8952,482,3294862,368.05875781948168,12522493.638646405,1398.848708517248,4277,1383,"Gersau, Lauerz, Morschach, Schwyz",4
1365,Lauerz,Schwyz,1114,34,360787,323.86624775583482,799869.34387175424,718.01556900516539,468,160,"Gersau, Arth, Ingenbohl, Schwyz, Steinen, Steinerberg",6
1366,Morschach,Schwyz,1148,63,137586,119.84843205574913,1096231.7104311711,954.90567110729194,466,192,"Sisikon, Ingenbohl, Muotathal, Riemenstalden, Schwyz",5
1367,Muotathal,Schwyz,3486,120,420981,120.76333907056798,1439563.9021355144,412.95579521959678,1482,513,"Bürglen (UR), Spiringen, Unterschächen, Innerthal, Illgau, Morschach, Oberiberg, Riemenstalden, Schwyz, Unteriberg, Glarus Süd, Glarus",12
1368,Oberiberg,Schwyz,870,74,223387,256.76666666666665,1116200.9860989177,1282.9896391941581,446,152,"Einsiedeln, Alpthal, Illgau, Muotathal, Schwyz, Unteriberg",6
1369,Riemenstalden,Schwyz,86,*,596,6.9302325581395348,4822.3752298268337,56.074130579381787,17,NA,"Bürglen (UR), Sisikon, Morschach, Muotathal, Riemenstalden",5
1370,Rothenthurm,Schwyz,2460,110,396545,161.19715447154471,1603116.0481119831,651.67319028942404,939,378,"Einsiedeln, Alpthal, Sattel, Schwyz, Oberägeri",5
1371,Sattel,Schwyz,1925,90,231130,120.06753246753247,2407955.7978571421,1250.8861287569569,872,269,"Rothenthurm, Schwyz, Steinen, Steinerberg, Oberägeri, Unterägeri",6
1372,Schwyz,Schwyz,15239,1022,10592149,695.06850843231189,23316077.911181834,1530.0267675819825,7091,2168,"Alpthal, Illgau, Ingenbohl, Lauerz, Morschach, Muotathal, Oberiberg, Rothenthurm, Sattel, Steinen",10
1373,Steinen,Schwyz,3608,118,652211,180.76801552106431,2449019.5247507882,678.77481284667078,1603,493,"Arth, Lauerz, Sattel, Schwyz, Steinerberg",5
1374,Steinerberg,Schwyz,939,43,27910,29.723109691160808,857013.47900008305,912.68741107570077,419,130,"Arth, Lauerz, Sattel, Steinen, Unterägeri, Zug",6
1375,Unteriberg,Schwyz,2398,121,389367,162.37155963302752,1433287.5293882873,597.70122159645007,1141,367,"Einsiedeln, Innerthal, Muotathal, Oberiberg, Unteriberg",5
1401,Alpnach,Obwalden,6053,538,5248737,867.12985296547163,4909089.25,811.01755327936564,2740,759,"Entlebuch, Schwarzenberg, Kerns, Sarnen, Ennetmoos, Hergiswil (NW), Stansstad",7
1402,Engelberg,Obwalden,4186,563,2488348,594.44529383659824,11957543.75,2856.5560797897756,2195,585,"Innertkirchen, Attinghausen, Isenthal, Wassen, Wolfenschiessen",5
1403,Giswil,Obwalden,3657,182,998582,273.06043204812687,2217033.65,606.24382007109648,1614,567,"Hofstetten bei Brienz, Schwanden bei Brienz, Flühli, Lungern, Sachseln, Sarnen",6
1404,Kerns,Obwalden,6295,372,1069857,169.95345512311357,4537784.45,720.85535345512312,2774,845,"Hasliberg, Innertkirchen, Alpnach, Lungern, Sachseln, Sarnen, Dallenwil, Ennetmoos, Wolfenschiessen",9
1405,Lungern,Obwalden,2111,120,599519,283.99763145428705,2665471.85,1262.6583846518238,938,303,"Brienzwiler, Hofstetten bei Brienz, Hasliberg, Meiringen, Giswil, Kerns, Sachseln",7
1406,Sachseln,Obwalden,5170,347,11083290,2143.7698259187623,6342279.4000000004,1226.7464990328822,2372,717,"Giswil, Kerns, Lungern, Sarnen",4
1407,Sarnen,Obwalden,10458,1463,17882634,1709.9477911646586,42430350.450000003,4057.2146156052786,4945,1329,"Entlebuch, Flühli, Hasle (LU), Alpnach, Giswil, Kerns, Sachseln, Sarnen",8
1501,Beckenried,Nidwalden,3697,214,593326,160.48850419258858,5883007.3499999996,1591.2922234243981,1807,405,"Isenthal, Buochs, Emmetten, Oberdorf (NW), Wolfenschiessen",5
1502,Buochs,Nidwalden,5285,288,2922290,552.94039735099341,5441185.5499999998,1029.5526111636707,2469,675,"Beckenried, Ennetbürgen, Oberdorf (NW), Stans",4
1503,Dallenwil,Nidwalden,1832,114,435975,237.97762008733625,1097207.3500000001,598.91230895196509,857,248,"Kerns, Ennetmoos, Oberdorf (NW), Stans, Wolfenschiessen",5
1504,Emmetten,Nidwalden,1440,105,693790,481.79861111111109,2011479.3,1396.860625,783,178,"Isenthal, Seelisberg, Beckenried, Emmetten",4
1505,Ennetbürgen,Nidwalden,4779,260,993368,207.8610587989119,11582838,2423.6949152542375,2423,458,"Luzern, Buochs, Stans, Stansstad",4
1506,Ennetmoos,Nidwalden,2199,85,793519,360.85447930877672,1929524.7,877.45552523874483,993,274,"Alpnach, Kerns, Dallenwil, Stans, Stansstad",5
1507,Hergiswil (NW),Nidwalden,5776,1402,33937560,5875.6163434903046,54984203.149999999,9519.4257531163439,3073,652,"Horw, Kriens, Schwarzenberg, Alpnach, Hergiswil (NW), Stansstad",6
1508,Oberdorf (NW),Nidwalden,3114,110,1179586,378.80089916506103,2218395.4,712.39415542710333,1478,369,"Beckenried, Buochs, Dallenwil, Oberdorf (NW), Stans, Wolfenschiessen",6
1509,Stans,Nidwalden,8254,889,26696122,3234.3254179791616,10050036.85,1217.5959353040948,4041,1007,"Buochs, Dallenwil, Ennetbürgen, Ennetmoos, Oberdorf (NW), Stansstad",6
1510,Stansstad,Nidwalden,4624,528,4928685,1065.8920847750865,12196509.75,2637.653492647059,2409,484,"Luzern, Alpnach, Ennetbürgen, Ennetmoos, Hergiswil (NW), Stans, Stansstad",7
1511,Wolfenschiessen,Nidwalden,2087,93,1462494,700.76377575467177,898163.35,430.36097268806901,857,309,"Innertkirchen, Isenthal, Engelberg, Kerns, Beckenried, Dallenwil, Oberdorf (NW), Wolfenschiessen",8
1630,Glarus Nord,Glarus,18626,1007,12205085,655.27139482443897,14974335.1,803.94798131643938,8274,2502,"Innerthal, Reichenburg, Schübelbach, Glarus Süd, Glarus, Quarten, Benken (SG), Schänis, Weesen",9
1631,Glarus Süd,Glarus,9453,500,4618161,488.53919390669631,6325158.8499999996,669.11656088014388,4529,1440,"Silenen, Spiringen, Muotathal, Glarus Nord, Glarus, Flums, Mels, Pfäfers, Quarten, Laax, Ilanz/Glion, Flims, Breil/Brigels, Disentis/Mustér, Sumvitg, Trun",16
1632,Glarus,Glarus,12511,1036,23594928,1885.9346175365679,11624022.449999999,929.10418431780033,5567,1784,"Innerthal, Muotathal, Glarus Nord, Glarus Süd, Glarus",5
1701,Baar,Zug,24617,5936,368060272,14951.467359954502,73575312.63125658,2988.800935583401,11641,2891,"Hausen am Albis, Kappel am Albis, Menzingen, Neuheim, Steinhausen, Unterägeri, Zug",7
1702,Cham,Zug,16893,2467,123283208,7297.8871722015037,40978139.130406871,2425.7467075360723,7943,1863,"Knonau, Maschwanden, Hünenberg, Steinhausen, Zug",5
1703,Hünenberg,Zug,8784,1631,19152762,2180.414617486339,29660324.223736431,3376.6307176384826,4082,995,"Maschwanden, Obfelden, Cham, Risch, Dietwil, Merenschwand, Mühlau, Oberrüti, Sins",9
1704,Menzingen,Zug,4551,251,859067,188.76444737420348,6114734.9989594035,1343.6025047153162,2026,743,"Wädenswil, Horgen, Baar, Neuheim, Oberägeri, Unterägeri",6
1705,Neuheim,Zug,2237,230,1246549,557.24139472507818,5521827.4374313531,2468.4074373854955,1021,256,"Hausen am Albis, Horgen, Baar, Menzingen, Neuheim",5
1706,Oberägeri,Zug,6244,486,1146842,183.67104420243433,34137954.717800446,5467.321383376112,2911,735,"Wädenswil, Einsiedeln, Feusisberg, Rothenthurm, Sattel, Menzingen, Unterägeri",7
1707,Risch,Zug,10990,1482,88403612,8044.0047315741585,30198838.879424345,2747.847031794754,5335,1144,"Honau, Meierskappel, Root, Hünenberg, Dietwil, Oberrüti",6
1708,Steinhausen,Zug,10129,1390,193410263,19094.704610524237,20657159.764567278,2039.4076181821777,4734,1163,"Kappel am Albis, Knonau, Baar, Cham, Zug",5
1709,Unterägeri,Zug,8868,563,3031450,341.84145241317094,23353654.173486147,2633.47476020367,4058,1009,"Sattel, Steinerberg, Baar, Menzingen, Oberägeri, Walchwil, Zug",7
1710,Walchwil,Zug,3711,341,1510956,407.15602263540825,28831240.064732745,7769.1296321025993,1773,450,"Arth, Unterägeri, Zug",3
1711,Zug,Zug,30618,13819,918445484,29996.913057678488,222592847.28819838,7269.9995848258668,15187,3490,"Arth, Steinerberg, Baar, Cham, Steinhausen, Unterägeri, Walchwil, Zug",8
2008,Châtillon (FR),Fribourg / Freiburg,484,13,15120,31.239669421487605,499794.41,1032.6330785123967,226,67,"Châtillon (FR), Estavayer, Cheyres-Châbles",3
2009,Cheiry,Fribourg / Freiburg,390,10,4768,12.225641025641025,126486.75,324.32499999999999,156,72,NA,NA
2011,Cugy (FR),Fribourg / Freiburg,1767,40,183811,104.0243350311262,1181265.8799999999,668.51492925863033,726,333,"Cugy (FR), Fétigny, Ménières, Les Montets, Estavayer, Payerne",6
2016,Fétigny,Fribourg / Freiburg,1068,18,33659,31.515917602996254,580364.93000000005,543.41285580524345,448,174,"Cugy (FR), Ménières, Payerne, Trey, Valbroye",5
2022,Gletterens,Fribourg / Freiburg,1097,31,70696,64.444849589790337,794851.12,724.56802187784865,471,174,"Vallon, Delley-Portalban, Chevroux, Grandcour",4
2025,Lully (FR),Fribourg / Freiburg,1178,21,104905,89.053480475382003,585454.96,496.99062818336159,436,200,"Lully (FR), Les Montets, Estavayer, Cheyres-Châbles",4
2027,Ménières,Fribourg / Freiburg,437,10,56957,130.33638443935928,286780.05,656.24725400457669,168,58,"Cugy (FR), Fétigny, Les Montets, Valbroye",4
2029,Montagny (FR),Fribourg / Freiburg,2677,59,113639,42.450130743369442,1413616.15,528.05982443033247,1139,431,"Montagny (FR), Belmont-Broye, Torny, Ponthaux, Prez, Corcelles-près-Payerne, Payerne",7
2035,Nuvilly,Fribourg / Freiburg,446,60,31596,70.843049327354265,257969.16,578.40618834080715,173,81,"Les Montets, Estavayer, Treytorrens (Payerne), Valbroye",4
2038,Prévondavaux,Fribourg / Freiburg,72,*,42,0.58333333333333337,21775.46,302.43694444444441,31,9,"Surpierre, Lucens, Villars-le-Comte, Montanaire, Valbroye",5
2041,Saint-Aubin (FR),Fribourg / Freiburg,1835,59,172280,93.885558583106274,1229986.5900000001,670.2924196185287,801,259,"Saint-Aubin (FR), Vallon, Delley-Portalban, Belmont-Broye, Avenches, Vully-les-Lacs, Missy",7
2043,Sévaz,Fribourg / Freiburg,304,25,74866,246.26973684210526,184973.63,608.46588815789471,124,44,"Les Montets, Estavayer",2
2044,Surpierre,Fribourg / Freiburg,725,14,26816,36.987586206896552,401521.62,553.82292413793107,312,134,"Prévondavaux, Lucens, Henniez, Valbroye",4
2045,Vallon,Fribourg / Freiburg,455,11,16067,35.312087912087911,497201.27,1092.750043956044,181,71,"Gletterens, Saint-Aubin (FR), Delley-Portalban, Corcelles-près-Payerne, Grandcour, Missy",6
2050,Les Montets,Fribourg / Freiburg,1520,44,139429,91.729605263157893,918146.7,604.04388157894732,614,251,"Cugy (FR), Lully (FR), Ménières, Nuvilly, Sévaz, Estavayer, Valbroye",7
2051,Delley-Portalban,Fribourg / Freiburg,1173,38,33420,28.491048593350385,1438284.92,1226.1593520886615,566,172,"Gletterens, Saint-Aubin (FR), Vallon, Vully-les-Lacs",4
2053,Belmont-Broye,Fribourg / Freiburg,5559,205,1020358,183.55063860406548,3388144.11,609.48805720453322,2236,929,"Montagny (FR), Saint-Aubin (FR), Grolley, Ponthaux, Misery-Courtion, Avenches, Corcelles-près-Payerne, Missy",8
2054,Estavayer,Fribourg / Freiburg,9762,412,1567054,160.52591682032372,6926106.6500000004,709.49668612989149,4174,1660,"Châtillon (FR), Cugy (FR), Lully (FR), Nuvilly, Sévaz, Les Montets, Cheyres-Châbles, Montanaire, Champtauroz, Chevroux, Grandcour, Payerne, Treytorrens (Payerne), Valbroye, Chavannes-le-Chêne, Démoret",16
2055,Cheyres-Châbles,Fribourg / Freiburg,2317,74,79116,34.1458782908934,2362717.41,1019.7312947777299,1079,358,"Châtillon (FR), Lully (FR), Estavayer, Chavannes-le-Chêne, Rovray, Yvonand",6
2061,Auboranges,Fribourg / Freiburg,282,13,209167,741.72695035460993,2306457.25,8178.9264184397161,118,43,"Ecublens (FR), Rue, Servion, Oron, Jorat-Mézières",5
2063,Billens-Hennens,Fribourg / Freiburg,786,13,8160,10.381679389312977,418427.2,532.35012722646309,335,143,"Romont (FR), Siviriez, Lovatens, Lucens, Prévonloup",5
2066,Chapelle (Glâne),Fribourg / Freiburg,302,16,42071,139.30794701986756,239904.96,794.38728476821188,110,47,"Chapelle (Glâne), Rue, Le Flon, Oron",4
2067,Le Châtelard,Fribourg / Freiburg,364,9,74187,203.81043956043956,192166.69,527.93046703296704,139,66,"Grangettes, Massonnens, Villorsonnens, Marsens, Sorens",5
2068,Châtonnaye,Fribourg / Freiburg,830,35,105551,127.16987951807229,391561.22,471.76050602409634,334,165,"Torny, Villaz, Trey, Villarzel, Valbroye",5
2072,Ecublens (FR),Fribourg / Freiburg,335,5,2703,8.0686567164179106,476060.11,1421.0749552238806,147,52,"Auboranges, Ecublens (FR), Montet (Glâne), Rue, Vulliens, Jorat-Mézières",6
2079,Grangettes,Fribourg / Freiburg,222,5,722,3.2522522522522523,180137.58,811.43054054054051,75,38,"Le Châtelard, Massonnens, Vuisternens-devant-Romont, Marsens, Sâles",5
2086,Massonnens,Fribourg / Freiburg,533,11,34263,64.283302063789876,337753.99,633.68478424015007,189,84,"Le Châtelard, Grangettes, Mézières (FR), Vuisternens-devant-Romont, Villorsonnens, Villaz",6
2087,Mézières (FR),Fribourg / Freiburg,1044,22,63899,61.205938697318011,834686.58,799.50821839080459,428,189,"Massonnens, Mézières (FR), Romont (FR), Siviriez, Vuisternens-devant-Romont, Villaz",6
2089,Montet (Glâne),Fribourg / Freiburg,394,*,0,0,238404.45,605.08743654822342,166,53,"Ecublens (FR), Montet (Glâne), Rue, Ursy, Chavannes-sur-Moudon, Moudon, Vulliens",7
2096,Romont (FR),Fribourg / Freiburg,5366,265,874290,162.93142005218039,2841515.08,529.54064107342526,2040,1003,"Billens-Hennens, Mézières (FR), Romont (FR), Siviriez, Villaz, Dompierre (VD), Prévonloup, Villarzel, Valbroye",9
2097,Rue,Fribourg / Freiburg,1524,33,18170,11.92257217847769,1018896.39,668.56718503937009,678,229,"Auboranges, Chapelle (Glâne), Ecublens (FR), Montet (Glâne), Ursy, Le Flon, Oron",7
2099,Siviriez,Fribourg / Freiburg,2281,83,559706,245.37746602367383,1424511.52,624.51184568171857,965,357,"Billens-Hennens, Mézières (FR), Romont (FR), Ursy, Vuisternens-devant-Romont, Le Flon, Lucens",7
2102,Ursy,Fribourg / Freiburg,3271,82,420057,128.41852644451239,2300894.58,703.4223723631917,1327,499,"Montet (Glâne), Rue, Siviriez, Le Flon, Chavannes-sur-Moudon, Lucens",6
2111,Villaz-Saint-Pierre,Fribourg / Freiburg,1315,41,255440,194.25095057034221,685602.78,521.37093536121677,539,198,NA,NA
2113,Vuisternens-devant-Romont,Fribourg / Freiburg,2330,67,211144,90.619742489270379,1341497.6299999999,575.75005579399135,930,397,"Grangettes, Massonnens, Mézières (FR), Siviriez, Sâles, Le Flon, La Verrerie",7
2114,Villorsonnens,Fribourg / Freiburg,1498,24,28404,18.961281708945261,884439.9,590.4138184245661,585,267,"Le Châtelard, Massonnens, Villaz, Sorens, Autigny, Chénens, Gibloux",7
2115,Torny,Fribourg / Freiburg,973,19,52455,53.910585817060635,516570.6,530.90503597122301,377,158,"Montagny (FR), Châtonnaye, Villaz, La Brillaz, Prez, Payerne, Trey",7
2116,La Folliaz,Fribourg / Freiburg,988,22,27656,27.991902834008098,535701.01,542.20749999999998,403,151,NA,NA
2121,Haut-Intyamon,Fribourg / Freiburg,1559,53,106549,68.34445157152021,660144.82999999996,423.44119948685051,660,276,"Grandvillard, Gruyères, Bas-Intyamon, Châtel-Saint-Denis, Semsales, Château-d'Oex, Rossinière, Montreux, Veytaux, Blonay - Saint-Légier",10
2122,Pont-en-Ogoz,Fribourg / Freiburg,1920,71,106397,55.415104166666666,1910885.86,995.25305208333339,877,302,"Marsens, Sorens, Gibloux",3
2123,Botterens,Fribourg / Freiburg,616,16,8719,14.154220779220779,501352.52,813.88396103896105,242,103,"Broc, Châtel-sur-Montsalvens, Corbières, Val-de-Charmey",4
2124,Broc,Fribourg / Freiburg,2627,52,63158,24.041872858774266,1412119.56,537.54075371145791,1135,443,"Botterens, Bulle, Châtel-sur-Montsalvens, Crésuz, Gruyères, Morlon, Val-de-Charmey",7
2125,Bulle,Fribourg / Freiburg,23871,1055,13918764,583.0825688073395,19091246.239999998,799.76734280088806,9528,3844,"Broc, Echarlens, Gruyères, Morlon, Le Pâquier (FR), Riaz, Vuadens",7
2128,Châtel-sur-Montsalvens,Fribourg / Freiburg,295,6,8457,28.667796610169493,209677.37,710.77074576271184,157,45,"Botterens, Broc, Crésuz, Val-de-Charmey",4
2129,Corbières,Fribourg / Freiburg,908,21,90726,99.918502202643168,712926.5,785.1613436123348,399,144,"Botterens, Hauteville, Val-de-Charmey",3
2130,Crésuz,Fribourg / Freiburg,398,5,14900,37.437185929648244,1208327.1100000001,3035.9977638190958,210,56,"Broc, Châtel-sur-Montsalvens, Val-de-Charmey",3
2131,Echarlens,Fribourg / Freiburg,829,14,11694,14.106151990349819,892957.82,1077.1505669481303,359,116,"Bulle, Marsens, Morlon, Riaz, Vuadens",5
2134,Grandvillard,Fribourg / Freiburg,847,22,235737,278.31995277449823,743599.9,877.92195985832348,338,146,"Haut-Intyamon, Bas-Intyamon, Val-de-Charmey, Château-d'Oex",4
2135,Gruyères,Fribourg / Freiburg,2212,94,500075,226.0736889692586,1882857.52,851.20141048824598,924,407,"Haut-Intyamon, Broc, Bulle, Le Pâquier (FR), Vaulruz, Vuadens, Bas-Intyamon, Val-de-Charmey, Semsales",9
2137,Hauteville,Fribourg / Freiburg,681,18,286898,421.28928046989722,587390.26,862.54076358296629,268,110,"Corbières, La Roche, Val-de-Charmey",3
2138,Jaun,Fribourg / Freiburg,643,25,303498,472.0031104199067,170018.78,264.41489891135302,255,161,"Boltigen, Saanen, Val-de-Charmey, Plaffeien",4
2140,Marsens,Fribourg / Freiburg,1959,41,108626,55.449719244512508,1950062.81,995.43788157223071,795,332,"Le Châtelard, Grangettes, Pont-en-Ogoz, Echarlens, Riaz, Sâles, Sorens",7
2143,Morlon,Fribourg / Freiburg,638,8,10250,16.065830721003135,845020.55,1324.4836206896553,292,99,"Broc, Bulle, Echarlens, Morlon",4
2145,Le Pâquier (FR),Fribourg / Freiburg,1336,30,45571,34.110029940119759,2113076.7000000002,1581.6442365269463,532,215,"Bulle, Gruyères, Le Pâquier (FR)",3
2147,Pont-la-Ville,Fribourg / Freiburg,595,22,37730,63.411764705882355,688818.12,1157.677512605042,270,84,"La Roche, Treyvaux, Gibloux",3
2148,Riaz,Fribourg / Freiburg,2791,78,316290,113.32497312791114,2442929.98,875.2884199211752,1225,390,"Bulle, Echarlens, Marsens, Sâles, Vaulruz, Vuadens",6
